78873400200017;MADAME ROXANE FAY METRA;"";"";66 AVENUE GENERAL LECLERC;"";38200 VIENNE;FRANCE;84;38;3;99;544;VIENNE;00;243800455;5;56;;42;8211;66;"";AV;GAL LECLERC;38200;"";;1;"";;5;Profession libérale ;8552Z;Enseignement culturel;2012;00;NN;20121011;2012;1;201209;"";"";"";P;S;0;O;"";;FAY*FAY-METRA/ROXANE/;"";2;"";"";8552Z;Enseignement culturel;2012;"";00;NN;2012;PME;20121011;201209;1;S;O;"";"";"";"";"";"";"";;;;84;38544;I;"";1;"";"";27/02/2018
78873400200017;MADAME ROXANE FAY-METRA;"";"";66 AV GAL LECLERC;"";38200 VIENNE;"";84;38;3;99;544;VIENNE;00;243800455;5;56;;42;8211;66;"";AV;GAL LECLERC;38200;"";;1;"";;9;Autre entrepreneur individuel;9329Z;Autres activités récréatives et de loisirs;2016;00;NN;20121011;2012;1;201209;"";"";"";P;S;0;O; ;;FAY*FAY-METRA/ROXANE/;"";2;"";"";9329Z;Autres activités récréatives et de loisirs;2016;"";00;NN;2012;PME;20121011;201209;1;S;O;"";"";"";"";"";"";"";;;;84;38544;F;0;1;1;1;27/02/2018
79005857200039;GRAP GPT REG ALIMENTAIRE PROXIMITE;GRAP RESTAURATION;1 3;1 RUE DES CLERCS;"";38200 VIENNE;FRANCE;84;38;3;99;544;VIENNE;00;243800455;5;56;;42;8211;1;"";RUE;DES CLERCS;38200;"";;0;"";;"";"";5610A;Restauration traditionnelle;2013;00;0;20131024;2015;1;201311;99;99;"";P;S;0;O; ;;GRAP - GROUPEMENT REGIONAL ALIMENTAIRE DE PROXIMITE;"";"";5560;Autre SA coopérative à conseil d'administration ;4711C;Supérettes;2015;"";12;20;2015;PME;20130101;201209;1;S;O;"";"";"";"";"";"";"";;;;84;38544;E;"";1;"";"";27/02/2018
79095175000021;MONSIEUR JOSHUA FERRATON;EIRL FERRATON;"";45 CHEMIN DE BEAUREGARD;"";38200 VIENNE;FRANCE;84;38;3;99;544;VIENNE;00;243800455;5;56;;42;8211;45;"";CHE;DE BEAUREGARD;38200;"";;1;"";;3;Artisan ;4312A;Travaux de terrassement courants et travaux préparatoires;2014;02;3;20140701;2015;1;201512;"";"";"";P;S;0;O;"";;FERRATON*JOSHUA/;"";1;"";"";4312A;Travaux de terrassement courants et travaux préparatoires;2013;4312AZ;02;3;2015;PME;20130211;201302;1;S;O;"";"";"";"";"";"";"";;;;84;38544;I;"";1;"";"";27/02/2018
79095175000021;MONSIEUR JOSHUA FERRATON;EIRL FERRATON;"";45 CHE DE BEAUREGARD;"";38200 VIENNE;"";84;38;3;99;544;VIENNE;00;243800455;5;56;;42;8211;45;"";CHE;DE BEAUREGARD;38200;"";;1;"";;3;Artisan ;8130Z;Services d'aménagement paysager;2017;02;3;20140701;2015;1;201512;14;91;"";P;S;0;O; ;;FERRATON*JOSHUA/;"";1;"";"";8130Z;Services d'aménagement paysager;2017;4312AZ;02;3;2015;PME;20130211;201302;1;S;O;"";"";"";"";"";"";"";;;;84;38544;F;1;1;1;1;27/02/2018
79417224700031;MADAME AMANDINE MELINAND;"";"";9 RUE JACQUARD;"";38200 VIENNE;FRANCE;84;38;3;99;544;VIENNE;00;243800455;5;56;;42;8211;9;"";RUE;JACQUARD;38200;"";;1;"";;5;Profession libérale ;8690E;Activité profess. rééducation appareillage & pédicures-podologues;2016;00;NN;20161101;2016;1;201610;"";"";"";P;S;0;O;"";;MELINAND*AMANDINE/;"";2;"";"";8690E;Activité profess. rééducation appareillage & pédicures-podologues;2013;"";00;NN;2016;PME;20130701;201307;1;S;O;"";"";"";"";"";"";"";;;;84;38544;E;"";1;"";"";27/02/2018
79446468500021;QUARNESS;"";ESPACE ST GERMAIN BATIMENT ELLIPSE;30 AV GAL LECLERC;"";38200 VIENNE;"";84;38;3;99;544;VIENNE;00;243800455;5;56;;42;8211;30;"";AV;GAL LECLERC;38200;"";;1;"";;"";"";7022Z;Conseil pour les affaires et autres conseils de gestion;2016;00;NN;20161111;2016;1;201701;"";"";"";P;S;0;O; ;;QUARNESS;"";"";5720;Société par actions simplifiée à associé unique ou société par actions simplifiée unipersonnelle ;7022Z;Conseil pour les affaires et autres conseils de gestion;2013;"";01;1;2015;PME;20130801;201307;1;S;O;"";"";"";"";"";"";"";;;;84;38544;I;"";1;"";"";27/02/2018
79446468500021;QUARNESS;"";ESPACE ST GERMAIN BATIMENT ELLIPSE;30 AV GAL LECLERC;"";38200 VIENNE;"";84;38;3;99;544;VIENNE;00;243800455;5;56;;42;8211;30;"";AV;GAL LECLERC;38200;"";;1;"";;"";"";5829C;Edition de logiciels applicatifs;2017;00;NN;20161111;2016;1;201701;99;99;"";P;S;0;O; ;;QUARNESS;"";"";5720;Société par actions simplifiée à associé unique ou société par actions simplifiée unipersonnelle ;5829C;Edition de logiciels applicatifs;2017;"";01;1;2015;PME;20130801;201307;1;S;O;"";"";"";"";"";"";"";;;;84;38544;F;1;1;1;1;27/02/2018
79454133400023;MONSIEUR REMY REQUET;"";RESIDENCE CARRE SUD;7 RUE DU 11 NOVEMBRE;"";38200 VIENNE;FRANCE;84;38;3;99;544;VIENNE;00;243800455;5;56;;42;8211;7;"";RUE;DU ONZE NOVEMBRE;38200;"";;1;"";;5;Profession libérale ;8559A;Formation continue d'adultes;2015;00;NN;20151104;2015;1;201511;"";"";"";P;S;0;O;"";;REQUET*REMY/;"";1;"";"";8559A;Formation continue d'adultes;2013;"";00;NN;2015;PME;20130812;201307;1;S;O;"";"";"";"";"";"";"";;;;84;38544;E;"";1;"";"";27/02/2018
79466046400015;TOUT POUR LES FETES;"";"";16 RUE JUIVERIE;"";38200 VIENNE;FRANCE;84;38;3;99;544;VIENNE;00;243800455;5;56;;42;8211;16;"";RUE;JUIVERIE;38200;"";;1;"";;"";"";4690Z;Commerce de gros (commerce interentreprises) non spécialisé;2013;00;NN;20130805;2013;6;201308;10;99;"";P;S;0;O;1;;TOUT POUR LES FETES;"";"";5498;SARL unipersonnelle ;4690Z;Commerce de gros (commerce interentreprises) non spécialisé;2013;"";00;NN;2013;PME;20130805;201308;1;S;O;"";"";"";"";"";"";"";;;;84;38544;E;"";1;"";"";27/02/2018
80093119800090;PROMAN 149;PROMAN;"";35 RUE VICTOR HUGO;"";38200 VIENNE;"";84;38;3;99;544;VIENNE;00;243800455;5;56;;42;8211;35;"";RUE;VICTOR HUGO;38200;"";;0;PROMAN;;"";"";7820Z;Activités des agences de travail temporaire;2017;01;NN;20170220;2017;1;201702;12;07;"";P;S;0;O; ;;PROMAN 149;"";"";5720;Société par actions simplifiée à associé unique ou société par actions simplifiée unipersonnelle ;7820Z;Activités des agences de travail temporaire;2014;"";02;3;2015;GE;20140228;201403;1;S;O;"";"";"";"";"";"";"";;;;93;38544;C;"";1;"";"";27/02/2018
80868852700015;MONSIEUR JEREMY VANSPRANGHE;OPEN RESTAURANT;STADE DE L ISLE;BOULEVARD PACATIANUS;"";38200 VIENNE;FRANCE;84;38;3;99;544;VIENNE;00;243800455;5;56;;42;8211;"";"";BD;PACATIANUS;38200;"";;1;OPEN RESTAURANT;;2;Commerçant ;5610A;Restauration traditionnelle;2015;01;1;20150105;2015;6;201501;12;99;"";P;S;0;O;"";;VANSPRANGHE*JEREMY/;"";1;"";"";5610A;Restauration traditionnelle;2015;"";01;1;2015;"";20150105;201501;1;S;O;"";"";"";"";"";"";"";;;;84;38544;E;"";1;"";"";27/02/2018
81314617200024;MONSIEUR DANIEL ADJAMIAN;ADJAMIAN DANIEL;4 B LOTISSEMENT BATIMENT;4 CHEMIN DE LA RECLUSIERE;"";38200 VIENNE;FRANCE;84;38;3;99;544;VIENNE;00;243800455;5;56;;42;8211;4;"";CHE;DE LA RECLUSIERE;38200;"";;1;"";;3;Artisan ;4932Z;Transports de voyageurs par taxis;2017;00;NN;20170101;2017;6;201702;12;93;"";P;S;0;O; ;;ADJAMIAN*DANIEL/;"";1;"";"";4932Z;Transports de voyageurs par taxis;2015;4932ZA;00;NN;2017;"";20150701;201702;"";S;O;"";"";"";"";"";"";"";;;;84;38544;C;"";1;"";"";27/02/2018
81418072500016;LES CREATIONS D ORION;MADAME MAGALI BOSC;RESIDENCE LES EMERAUDES;10 BOULEVARD EUGENE ARNAUD;"";38200 VIENNE;FRANCE;84;38;3;99;544;VIENNE;00;243800455;5;56;;42;8211;10;"";BD;EUGENE ARNAUD;38200;"";;1;"";;3;Artisan ;3299Z;Autres activités manufacturières n.c.a.;2015;00;NN;20151019;2015;1;201510;04;NR;"";P;S;0;O;"";;BOSC*MAGALI/;"";2;"";"";3299Z;Autres activités manufacturières n.c.a.;2015;3299ZG;00;NN;2015;"";20151019;201510;1;S;O;"";"";"";"";"";"";"";;;;84;38544;E;"";1;"";"";27/02/2018
81428329700012;FAITS DIVERS SYSTEM;"";"";CHEMIN DE LA BATIE;"";38200 VIENNE;FRANCE;84;38;3;99;544;VIENNE;00;243800455;5;56;;42;8211;"";"";CHE;DE LA BATIE;38200;"";;1;"";;"";"";9001Z;Arts du spectacle vivant;2015;00;NN;20151120;2015;1;201510;12;93;"";P;S;0;O;"";;FAITS DIVERS SYSTEM;"";"";5460;Autre SARL coopérative ;9001Z;Arts du spectacle vivant;2015;"";00;NN;2015;"";20151120;201510;1;S;O;"";"";"";"";"";"";"";;;;84;38544;E;"";1;"";"";27/02/2018
81464723600011;MADAME CAMILLE LEGER;CLEM CAMILLE LEGER ELECTRICITE MULTISE;"";16 B RUE DU 24 AVRIL 1915;"";38200 VIENNE;FRANCE;84;38;3;99;544;VIENNE;00;243800455;5;56;;42;8211;16;B;RUE;DU 24 AVRIL 1915;38200;"";;1;"";;3;Artisan ;4321A;Travaux d'installation électrique dans tous locaux;2015;00;NN;20151109;2015;1;201511;14;NR;"";P;S;0;O;"";;LEGER*CAMILLE/;"";2;"";"";4321A;Travaux d'installation électrique dans tous locaux;2015;4321AB;00;NN;2015;"";20151109;201511;1;S;O;"";"";"";"";"";"";"";;;;84;38544;E;"";1;"";"";27/02/2018
81804729200011;MADAME MARIE BUTTARD;"";"";24 RUE DE BOURGOGNE;"";38200 VIENNE;FRANCE;84;38;3;99;544;VIENNE;00;243800455;5;56;;42;8211;24;"";RUE;DE BOURGOGNE;38200;"";;1;"";;2;Commerçant ;4791B;Vente à distance sur catalogue spécialisé;2016;00;NN;20160101;2016;1;201601;10;99;"";P;S;0;O;"";;BERNARD*BUTTARD/MARIE ANNICK HELENE/;"";2;"";"";4791B;Vente à distance sur catalogue spécialisé;2016;"";00;NN;2016;"";20160101;201601;1;S;O;"";"";"";"";"";"";"";;;;84;38544;E;"";1;"";"";27/02/2018
82084581600017;SEVAN;"";"";2 RUE FRANCISQUE BONNIER;"";38200 VIENNE;FRANCE;84;38;3;99;544;VIENNE;00;243800455;5;56;;42;8211;2;"";RUE;FRANCISQUE BONNIER;38200;"";;1;"";;"";"";7010Z;Activités des sièges sociaux;2016;NN;NN;20160609;"";"";201606;"";"";"";P;S;0;O;"";;SEVAN;"";"";5710;SAS, société par actions simplifiée;0000Z;En attente de chiffrement sans activité;2016;"";NN;NN;"";"";20160609;201606;"";S;N;"";"";"";"";"";"";"";;;;84;38544;E;"";1;"";"";27/02/2018
82127206900013;MONSIEUR ILKER HILPERT;"";"";30 RUE DE LA CONVENTION;"";38200 VIENNE;FRANCE;84;38;3;99;544;VIENNE;00;243800455;5;56;;42;8211;30;"";RUE;DE LA CONVENTION;38200;"";;1;"";;3;Artisan ;4334Z;Travaux de peinture et vitrerie;2016;01;NN;20160620;2016;1;201607;14;91;"";P;S;0;O;"";;HILPERT*ILKER/;"";1;"";"";4334Z;Travaux de peinture et vitrerie;2016;4334ZB;01;NN;2016;"";20160620;201607;"";S;O;"";"";"";"";"";"";"";;;;84;38544;E;"";1;"";"";27/02/2018
82139201600019;MONSIEUR SI MOHAMED BOUZIDI;"";"";16 RUE EMILE ROMANET;"";38200 VIENNE;FRANCE;84;38;3;99;544;VIENNE;00;243800455;5;56;;42;8211;16;"";RUE;EMILE ROMANET;38200;"";;1;"";;2;Commerçant ;4511Z;Commerce de voitures et de véhicules automobiles légers;2016;00;NN;20160706;2016;1;201607;10;93;"";P;S;0;O;"";;BOUZIDI*SI MOHAMED/;"";1;"";"";4511Z;Commerce de voitures et de véhicules automobiles légers;2016;"";00;NN;2016;"";20160706;201607;"";S;O;"";"";"";"";"";"";"";;;;84;38544;E;"";1;"";"";27/02/2018
82379547100015;BEAL DEMARS;"";"";62 AV GAL LECLERC;"";38200 VIENNE;"";84;38;3;99;544;VIENNE;00;243800455;5;56;;42;8211;62;"";AV;GAL LECLERC;38200;"";;1;"";;"";"";5610C;Restauration de type rapide;2017;NN;NN;20161117;"";3;201611;04;05;"";P;S;0;O; ;;BEAL DEMARS;"";"";5499;Société à responsabilité limitée (sans autre indication);5610C;Restauration de type rapide;2017;1071CB;NN;NN;"";"";20161117;201611;"";S;O;"";"";"";"";"";"";"";;;;84;38544;I;"";1;"";"";27/02/2018
82379547100015;BEAL DEMARS;"";"";62 AV GAL LECLERC;"";38200 VIENNE;"";84;38;3;99;544;VIENNE;00;243800455;5;56;;42;8211;62;"";AV;GAL LECLERC;38200;"";;1;LE FOURNIL DE MARIUS;;"";"";5610C;Restauration de type rapide;2017;NN;NN;20161117;"";3;201611;04;05;"";P;S;0;O; ;;BEAL DEMARS;"";"";5499;Société à responsabilité limitée (sans autre indication);5610C;Restauration de type rapide;2017;1071CB;NN;NN;"";"";20161117;201611;"";S;O;"";"";"";"";"";"";"";;;;84;38544;F;0;1;0;0;27/02/2018
82398520500017;INNOV FERMETURE ET SYSTEMS;INNOV FERMETURE ET SYSTEMS;"";143 CHE DE MASSIER;"";38200 VIENNE;"";84;38;3;99;544;VIENNE;00;243800455;5;56;;42;8211;143;"";CHE;DE MASSIER;38200;"";;1;INNOV FERMETURE ET SYSTEMS;;"";"";4332B;Travaux de menuiserie métallique et serrurerie;2016;00;NN;20161201;2016;1;201611;05;91;"";P;S;0;O;"";;INNOV FERMETURE ET SYSTEMS;"";"";5710;SAS, société par actions simplifiée;4332B;Travaux de menuiserie métallique et serrurerie;2016;4332BB;00;NN;2016;"";20161201;201611;"";S;O;"";"";"";"";"";"";"";;;;84;38544;I;"";1;"";"";27/02/2018
82398520500017;INNOV FERMETURE ET SYSTEMS;INNOV FERMETURE ET SYSTEMS;"";143 CHE DE MASSIER;"";38200 VIENNE;"";84;38;3;99;544;VIENNE;00;243800455;5;56;;42;8211;143;"";CHE;DE MASSIER;38200;"";;1;INNOV FERMETURE ET SYSTEMS;;"";"";4332B;Travaux de menuiserie métallique et serrurerie;2016;00;NN;20161201;2016;1;201611;05;91;"";P;S;0;O; ;;INNOV FERMETURE ET SYSTEMS;"";"";5710;SAS, société par actions simplifiée;4332B;Travaux de menuiserie métallique et serrurerie;2016;4332BB;00;NN;2016;"";20161201;201611;"";S;O;"";"";"";"";"";"";"";;;;84;38544;F;0;1;0;0;27/02/2018
82404467100017;VEDOO;"";"";2 PLACE DRAPIERE;"";38200 VIENNE;FRANCE;84;38;3;99;544;VIENNE;00;243800455;5;56;;42;8211;2;"";PL;DRAPIERE;38200;"";;1;"";;"";"";7010Z;Activités des sièges sociaux;2016;NN;NN;20161014;"";"";201612;"";"";"";P;S;0;O;"";;VEDOO;"";"";5710;SAS, société par actions simplifiée;0000Z;En attente de chiffrement sans activité;2016;"";NN;NN;"";"";20161014;201612;"";S;N;"";"";"";"";"";"";"";;;;84;38544;I;"";1;"";"";27/02/2018
82404467100017;VEDOO;"";"";2 PL DRAPIERE;"";38200 VIENNE;"";84;38;3;99;544;VIENNE;00;243800455;5;56;;42;8211;2;"";PL;DRAPIERE;38200;"";;1;BAR DE LA PLACE;;"";"";5630Z;Débits de boissons;2016;NN;NN;20161014;"";3;201612;99;99;"";P;S;0;O; ;;VEDOO;"";"";5710;SAS, société par actions simplifiée;5630Z;Débits de boissons;2016;"";NN;NN;"";"";20161014;201612;"";S;O;"";"";"";"";"";"";"";;;;84;38544;F;1;1;1;1;27/02/2018
82437394800010;LES SIMONES;"";"";1 B RUE DES CLERCS;"";38200 VIENNE;"";84;38;3;99;544;VIENNE;00;243800455;5;56;;42;8211;1;B;RUE;DES CLERCS;38200;"";;1;"";;"";"";7010Z;Activités des sièges sociaux;2016;NN;NN;20161215;"";"";201612;"";"";"";P;S;0;O;"";;LES SIMONES;"";"";5458;SARL coopérative ouvrière de production et de crédit (SCOP) ;0000Z;En attente de chiffrement sans activité;2016;"";NN;NN;"";"";20161215;201612;"";S;N;"";"";"";"";"";"";"";;;;84;38544;I;"";1;"";"";27/02/2018
82437394800010;LES SIMONES;"";"";1 B RUE DES CLERCS;"";38200 VIENNE;"";84;38;3;99;544;VIENNE;00;243800455;5;56;;42;8211;1;B;RUE;DES CLERCS;38200;"";;1;LE SIMONE'S CAFE;;"";"";5610C;Restauration de type rapide;2017;NN;NN;20161215;"";1;201612;10;99;"";P;S;0;O; ;;LES SIMONES;"";"";5458;SARL coopérative ouvrière de production et de crédit (SCOP) ;5610C;Restauration de type rapide;2017;5610CQ;NN;NN;"";"";20161215;201612;"";S;O;"";"";"";"";"";"";"";;;;84;38544;F;1;1;1;1;27/02/2018
82437990300019;MADAME VIRGINIE PREMAILLON;L'ETOILE BIJOUTERIE;"";32 PL ST LOUIS;"";38200 VIENNE;"";84;38;3;99;544;VIENNE;00;243800455;5;56;;42;8211;32;"";PL;ST LOUIS;38200;"";;1;L'ETOILE;;2;Commerçant ;4778C;Autres commerces de détail spécialisés divers;2016;00;NN;20161223;2016;1;201612;10;05;1 ;P;S;0;O;"";;PREMAILLON*VIRGINIE SARAH VALENTINE/;"";2;"";"";4778C;Autres commerces de détail spécialisés divers;2016;"";00;NN;2016;"";20161223;201612;"";S;O;"";"";"";"";"";"";"";;;;84;38544;I;"";1;"";"";27/02/2018
82437990300019;MADAME VIRGINIE PREMAILLON;L'ETOILE BIJOUTERIE;"";32 PL ST LOUIS;"";38200 VIENNE;"";84;38;3;99;544;VIENNE;00;243800455;5;56;;42;8211;32;"";PL;ST LOUIS;38200;"";;1;L'ETOILE BIJOUTERIE;;2;Commerçant ;4789Z;Autres commerces de détail sur éventaires et marchés;2017;00;NN;20161223;2016;1;201612;08;05;1 ;P;S;0;O; ;;PREMAILLON*VIRGINIE SARAH VALENTINE/;"";2;"";"";4789Z;Autres commerces de détail sur éventaires et marchés;2017;"";00;NN;2016;"";20161223;201612;"";S;O;"";"";"";"";"";"";"";;;;84;38544;F;1;1;1;1;27/02/2018
82443280100010;ZAZA;LE CAUCASE DE ZAZA;"";36 CRS DE VERDUN;"";38200 VIENNE;"";84;38;3;99;544;VIENNE;00;243800455;5;56;;42;8211;36;"";CRS;DE VERDUN;38200;"";;1;LE CAUCASE DE ZAZA;;"";"";5610C;Restauration de type rapide;2017;00;NN;20170101;2017;1;201612;10;05;1 ;P;S;0;O;"";;ZAZA;"";"";5720;Société par actions simplifiée à associé unique ou société par actions simplifiée unipersonnelle ;5610C;Restauration de type rapide;2017;"";00;NN;2017;"";20170101;201612;"";S;O;"";"";"";"";"";"";"";;;;84;38544;I;"";1;"";"";27/02/2018
82443280100010;ZAZA;LE CAUCASE DE ZAZA;"";36 CRS DE VERDUN;"";38200 VIENNE;"";84;38;3;99;544;VIENNE;00;243800455;5;56;;42;8211;36;"";CRS;DE VERDUN;38200;"";;1;LE CAUCASE DE ZAZA;;"";"";5610C;Restauration de type rapide;2017;00;NN;20170101;2017;1;201612;10;05;1 ;P;S;0;O; ;;ZAZA;"";"";5720;Société par actions simplifiée à associé unique ou société par actions simplifiée unipersonnelle ;5610C;Restauration de type rapide;2017;5610CQ;00;NN;2017;"";20170101;201612;"";S;O;"";"";"";"";"";"";"";;;;84;38544;F;0;1;0;0;27/02/2018
82472227600014;SARL AMALINA DEVELOPPEMENT;"";"";3 SQ NINON VALLIN;"";38200 VIENNE;"";84;38;3;99;544;VIENNE;00;243800455;5;56;;42;8211;3;"";SQ;NINON VALLIN;38200;"";;1;"";;"";"";4511Z;Commerce de voitures et de véhicules automobiles légers;2017;00;NN;20170102;2017;1;201701;10;93;"";P;S;0;O; ;;SARL AMALINA DEVELOPPEMENT;"";"";5499;Société à responsabilité limitée (sans autre indication);4511Z;Commerce de voitures et de véhicules automobiles légers;2017;"";00;NN;2017;"";20170102;201701;"";S;O;"";"";"";"";"";"";"";;;;84;38544;E;"";1;"";"";27/02/2018
82509122600019;MONSIEUR PHILIPPE BENSOUSSAN;"";"";6 PL SAINT MAURICE;"";38200 VIENNE;"";84;38;3;99;544;VIENNE;00;243800455;5;56;;42;8211;6;"";PL;SAINT MAURICE;38200;"";;1;"";;5;Profession libérale ;6910Z;Activités juridiques;2017;00;NN;20170104;2017;1;201701;"";"";"";P;S;0;O; ;;BENSOUSSAN*PHILIPPE/;"";1;"";"";6910Z;Activités juridiques;2017;"";00;NN;2017;"";20170104;201701;"";S;O;"";"";"";"";"";"";"";;;;84;38544;E;"";1;"";"";27/02/2018
82520522200045;B V L V IMMOBILIER;CENTURY 21;"";52 RUE VICTOR HUGO;"";38200 VIENNE;FRANCE;84;38;3;99;544;VIENNE;00;243800455;5;56;;42;8211;52;"";RUE;VICTOR HUGO;38200;"";;0;CENTURY 21;;"";"";6831Z;Agences immobilières;2017;01;NN;20170207;2017;3;201702;99;99;"";P;S;0;O; ;;B.V.L.V. IMMOBILIER;"";"";5499;Société à responsabilité limitée (sans autre indication);6831Z;Agences immobilières;2017;"";00;NN;2017;"";20170120;201701;"";S;O;"";"";"";"";"";"";"";;;;84;38544;C;"";1;"";"";27/02/2018
82521094100019;MFC CROISIERES;LES CROISIERES DE JADE;"";28 RUE EDOUARD GIRERD;"";38200 VIENNE;"";84;38;3;99;544;VIENNE;00;243800455;5;56;;42;8211;28;"";RUE;EDOUARD GIRERD;38200;"";;1;"";;"";"";5010Z;Transports maritimes et côtiers de passagers;2017;00;NN;20170109;2017;1;201701;07;99;"";P;S;0;O; ;;MFC CROISIERES;"";"";5710;SAS, société par actions simplifiée;5010Z;Transports maritimes et côtiers de passagers;2017;"";00;NN;2017;"";20170109;201701;"";S;O;"";"";"";"";"";"";"";;;;84;38544;I;"";1;"";"";27/02/2018
82521094100019;MFC CROISIERES;LES CROISIERES DE JADE;"";28 RUE EDOUARD GIRERD;"";38200 VIENNE;"";84;38;3;99;544;VIENNE;00;243800455;5;56;;42;8211;28;"";RUE;EDOUARD GIRERD;38200;"";;1;"";;"";"";5030Z;Transports fluviaux de passagers;2017;00;NN;20170109;2017;1;201701;07;99;"";P;S;0;O; ;;MFC CROISIERES;"";"";5710;SAS, société par actions simplifiée;5030Z;Transports fluviaux de passagers;2017;"";00;NN;2017;"";20170109;201701;"";S;O;"";"";"";"";"";"";"";;;;84;38544;F;0;1;1;1;27/02/2018
82533885800012;LEMON B.;"";"";17 MTE DES GRANDS PRES;"";38200 VIENNE;"";84;38;3;99;544;VIENNE;00;243800455;5;56;;42;8211;17;"";MTE;DES GRANDS PRES;38200;"";;1;"";;"";"";7010Z;Activités des sièges sociaux;2017;NN;NN;20170131;"";"";201702;"";"";"";P;S;0;O; ;;LEMON B.;"";"";5720;Société par actions simplifiée à associé unique ou société par actions simplifiée unipersonnelle ;0000Z;En attente de chiffrement sans activité;2017;"";NN;NN;"";"";20170131;201702;"";S;N;"";"";"";"";"";"";"";;;;84;38544;C;"";1;"";"";27/02/2018
82536047200013;MONSIEUR ALEXANDRE TRIME;"";"";4 PL SAINT PIERRE;"";38200 VIENNE;"";84;38;3;99;544;VIENNE;00;243800455;5;56;;42;8211;4;"";PL;SAINT PIERRE;38200;"";;1;"";;5;Profession libérale ;6910Z;Activités juridiques;2017;00;NN;20170102;2017;1;201702;"";"";"";P;S;0;O; ;;TRIME*ALEXANDRE/;"";1;"";"";6910Z;Activités juridiques;2017;"";00;NN;2017;"";20170102;201702;"";S;O;"";"";"";"";"";"";"";;;;84;38544;C;"";1;"";"";27/02/2018
82536832700011;ALLOOBROGES BILLARD CLUB;"";"";5 RUE VOLTAIRE;"";38200 VIENNE;"";84;38;3;99;544;VIENNE;00;243800455;5;56;;42;8211;5;"";RUE;VOLTAIRE;38200;"";;1;"";;"";"";9312Z;Activités de clubs de sports;2014;00;NN;20140520;2014;1;201702;99;99;"";P;S;0;N; ;;ALLOOBROGES BILLARD CLUB;"";"";9220;Association déclarée ;9312Z;Activités de clubs de sports;2014;"";00;NN;2014;"";20140520;201702;"";S;N;"";"";"";"";"";"";"";;;;84;38544;C;"";1;"";"";27/02/2018
82537420000012;TAKABATUKE;"";BATIMENT C - VIMAINE 2;43 RUE VIMAINE;"";38200 VIENNE;"";84;38;3;99;544;VIENNE;00;243800455;5;56;;42;8211;43;"";RUE;VIMAINE;38200;"";;1;"";;"";"";9001Z;Arts du spectacle vivant;2016;00;NN;20161103;2016;1;201702;99;99;"";P;S;0;N; ;;TAKABATUKE;"";"";9220;Association déclarée ;9001Z;Arts du spectacle vivant;2016;"";00;NN;2016;"";20161103;201702;"";S;N;"";"";"";"";"";"";"";;;;84;38544;C;"";1;"";"";27/02/2018
82538110600012;MONSIEUR ALEXANDRE RIOU;"";"";10 PL ANDRE RIVOIRE;"";38200 VIENNE;"";84;38;3;99;544;VIENNE;00;243800455;5;56;;42;8211;10;"";PL;ANDRE RIVOIRE;38200;"";;1;"";;1;Artisan-commerçant ;9512Z;Réparation d'équipements de communication;2017;00;NN;20170215;2017;1;201702;"";"";"";P;S;0;O; ;;RIOU*ALEXANDRE KEVIN/;"";1;"";"";9512Z;Réparation d'équipements de communication;2017;"";00;NN;2017;"";20170215;201702;"";S;O;"";"";"";"";"";"";"";;;;84;38544;C;"";1;"";"";27/02/2018
82748834700010;OSCAREX;"";"";38 MTE DE BON ACCUEIL;"";38200 VIENNE;"";84;38;3;99;544;VIENNE;00;243800455;5;56;;42;8211;38;"";MTE;DE BON ACCUEIL;38200;"";;1;"";;"";"";7010Z;Activités des sièges sociaux;2017;00;NN;20170120;2017;1;201702;NR;NR;"";P;S;0;O; ;;OSCAREX;"";"";5499;Société à responsabilité limitée (sans autre indication);7010Z;Activités des sièges sociaux;2017;"";00;NN;2017;"";20170120;201702;"";S;O;"";"";"";"";"";"";"";;;;84;38544;C;"";1;"";"";27/02/2018
82749285100015;LAZARE & MORGAN;LAZARE & MORGAN;"";4 RUE PEROUILLERE;"";38200 VIENNE;"";84;38;3;99;544;VIENNE;00;243800455;5;56;;42;8211;4;"";RUE;PEROUILLERE;38200;"";;1;"";;"";"";4791A;Vente à distance sur catalogue général;2017;00;NN;20170215;2017;1;201702;10;07;"";P;S;0;O; ;;LAZARE & MORGAN;"";"";5498;SARL unipersonnelle ;4791A;Vente à distance sur catalogue général;2017;"";00;NN;2017;"";20170215;201702;"";S;O;"";"";"";"";"";"";"";;;;84;38544;C;"";1;"";"";27/02/2018
82749452700019;AVEC 1 A;"";ESPACE ST GERMAIN BATIMENT LE SAXO;30 AV GAL LECLERC;"";38200 VIENNE;"";84;38;3;99;544;VIENNE;00;243800455;5;56;;42;8211;30;"";AV;GAL LECLERC;38200;"";;1;"";;"";"";7022Z;Conseil pour les affaires et autres conseils de gestion;2017;00;NN;20170125;2017;1;201702;12;07;"";P;S;0;O; ;;AVEC 1 A;"";"";5498;SARL unipersonnelle ;7022Z;Conseil pour les affaires et autres conseils de gestion;2017;"";00;NN;2017;"";20170125;201702;"";S;O;"";"";"";"";"";"";"";;;;84;38544;C;"";1;"";"";27/02/2018
82750071100011;MADAME CAROLINE GUILLET;BROC' ART;"";9 RUE CLEMENTINE;"";38200 VIENNE;"";84;38;3;99;544;VIENNE;00;243800455;5;56;;42;8211;9;"";RUE;CLEMENTINE;38200;"";;1;"";;2;Commerçant ;4791B;Vente à distance sur catalogue spécialisé;2017;00;NN;20170206;2017;1;201702;10;99;"";P;S;0;O; ;;GUILLET*CAROLINE/;"";2;"";"";4791B;Vente à distance sur catalogue spécialisé;2017;"";00;NN;2017;"";20170206;201702;"";S;O;"";"";"";"";"";"";"";;;;84;38544;C;"";1;"";"";27/02/2018
82750158600016;JEAN PHILIPPE IZAMBERT;"";"";11 CHE DE CHARAVEL;"";38200 VIENNE;"";84;38;3;99;544;VIENNE;00;243800455;5;56;;42;8211;11;"";CHE;DE CHARAVEL;38200;"";;1;"";;"";"";7022Z;Conseil pour les affaires et autres conseils de gestion;2017;00;NN;20170201;2017;1;201702;12;93;"";P;S;0;O; ;;JEAN PHILIPPE IZAMBERT;"";"";5498;SARL unipersonnelle ;7022Z;Conseil pour les affaires et autres conseils de gestion;2017;"";00;NN;2017;"";20170201;201702;"";S;O;"";"";"";"";"";"";"";;;;84;38544;C;"";1;"";"";27/02/2018
82751064500019;MONSIEUR FLORIAN MOUGLALIS;"";LES FAUVETTES;11 QUAI FREDERIC MISTRAL;"";38200 VIENNE;"";84;38;3;99;544;VIENNE;00;243800455;5;56;;42;8211;11;"";QUAI;FREDERIC MISTRAL;38200;"";;1;"";;2;Commerçant ;5530Z;Terrains de camping et parcs pour caravanes, véhicules de loisirs;2017;00;NN;20170301;2017;1;201702;"";"";"";P;S;0;O; ;;MOUGLALIS*FLORIAN/;"";1;"";"";5530Z;Terrains de camping et parcs pour caravanes, véhicules de loisirs;2017;"";00;NN;2017;"";20170301;201702;"";S;O;"";"";"";"";"";"";"";;;;84;38544;C;"";1;"";"";27/02/2018
82751546100016;MONSIEUR SALIM EL GHOUL;"";"";24 AV MARCELLIN BERTHELOT;"";38200 VIENNE;"";84;38;3;99;544;VIENNE;00;243800455;5;56;;42;8211;24;"";AV;MARCELLIN BERTHELOT;38200;"";;1;"";;3;Artisan ;4399B;Travaux de montage de structures métalliques;2017;01;NN;20170206;2017;1;201702;05;91;"";P;S;0;O; ;;EL GHOUL*SALIM/;"";1;"";"";4399B;Travaux de montage de structures métalliques;2017;4399BZ;01;NN;2017;"";20170206;201702;"";S;O;"";"";"";"";"";"";"";;;;84;38544;C;"";1;"";"";27/02/2018
82752072700013;MONSIEUR LAURENT COLOMBON;ALEVS;"";9 RUE JACQUARD;"";38200 VIENNE;"";84;38;3;99;544;VIENNE;00;243800455;5;56;;42;8211;9;"";RUE;JACQUARD;38200;"";;1;"";;3;Artisan ;8130Z;Services d'aménagement paysager;2017;00;NN;20170301;2017;1;201702;12;93;"";P;S;0;O; ;;COLOMBON*LAURENT/;"";1;"";"";8130Z;Services d'aménagement paysager;2017;"";00;NN;2017;"";20170301;201702;"";S;O;"";"";"";"";"";"";"";;;;84;38544;C;"";1;"";"";27/02/2018
82752640100019;MADAME HANANE BERHILA;"";"";24 AV MARCELLIN BERTHELOT;"";38200 VIENNE;"";84;38;3;99;544;VIENNE;00;243800455;5;56;;42;8211;24;"";AV;MARCELLIN BERTHELOT;38200;"";;1;"";;5;Profession libérale ;8622A;Activités de radiodiagnostic et de radiothérapie;2017;00;NN;20170306;2017;1;201702;"";"";"";P;S;0;O; ;;BERHILA*HANANE/;"";2;"";"";8622A;Activités de radiodiagnostic et de radiothérapie;2017;"";00;NN;2017;"";20170306;201702;"";S;O;"";"";"";"";"";"";"";;;;84;38544;C;"";1;"";"";27/02/2018
82752921500010;KARIM BENSAFI;KLOUDS;"";1 RUE TESTE DU BAILLER;"";38200 VIENNE;"";84;38;3;99;544;VIENNE;00;243800455;5;56;;42;8211;1;"";RUE;TESTE DU BAILLER;38200;"";;1;"";;"";"";8559A;Formation continue d'adultes;2017;00;NN;20170201;2017;1;201702;99;99;"";P;S;0;O; ;;KARIM BENSAFI;"";"";5720;Société par actions simplifiée à associé unique ou société par actions simplifiée unipersonnelle ;8559A;Formation continue d'adultes;2017;"";00;NN;2017;"";20170201;201702;"";S;O;"";"";"";"";"";"";"";;;;84;38544;C;"";1;"";"";27/02/2018
