79885646400010;LEFORT FRANCE;"";"";106 RUE DU CHAMP DE COURSES;"";38780 PONT EVEQUE;FRANCE;84;38;3;27;318;PONT EVEQUE;00;243800455;5;56;;21;8211;106;"";RUE;DU CHAMP DE COURSES;38780;"";;1;"";;"";"";3312Z;Réparation de machines et équipements mécaniques;2013;02;3;20131115;2015;1;201312;10;04;"";P;S;0;O;"";;LEFORT FRANCE;"";"";5710;SAS, société par actions simplifiée;3312Z;Réparation de machines et équipements mécaniques;2013;"";02;3;2015;PME;20131115;201312;1;S;O;"";"";"";"";"";"";"";;;;84;38318;E;"";1;"";"";27/02/2018
80921609600010;MONSIEUR JEAN BAPTISTE VIAL;"";"";14 CHEMIN DU PLAN ET DE LA FEYTA;"";38780 PONT EVEQUE;FRANCE;84;38;3;27;318;PONT EVEQUE;00;243800455;5;56;;21;8211;14;"";CHE;DU PLAN ET DE LA FEYTA;38780;"";;1;"";;2;Commerçant ;4619B;Autres intermédiaires du commerce en produits divers;2016;00;NN;20160101;2016;1;201501;99;99;"";P;S;0;O;"";;VIAL*JEAN BAPTISTE/;"";1;"";"";4619B;Autres intermédiaires du commerce en produits divers;2016;"";00;NN;2016;"";20160101;201501;1;S;O;"";"";"";"";"";"";"";;;;84;38318;E;"";1;"";"";27/02/2018
81215018300018;MONSIEUR FERHAT SARIER;SILA;"";18 RUE LOUIS LEYDIER;"";38780 PONT EVEQUE;FRANCE;84;38;3;27;318;PONT EVEQUE;00;243800455;5;56;;21;8211;18;"";RUE;LOUIS LEYDIER;38780;"";;1;SILA;;1;Artisan-commerçant ;5610A;Restauration traditionnelle;2015;00;NN;20150601;2015;3;201506;99;99;"";P;S;0;O;"";;SARIER*FERHAT/;"";1;"";"";5610A;Restauration traditionnelle;2015;5610CQ;00;NN;2015;"";20150601;201506;1;S;O;"";"";"";"";"";"";"";;;;84;38318;E;"";1;"";"";27/02/2018
81314617200016;MONSIEUR DANIEL ADJAMIAN;"";27 LOTISSEMENT;HAMEAU DE LA GERE;"";38780 PONT EVEQUE;FRANCE;84;38;3;27;318;PONT EVEQUE;00;243800455;5;56;;21;8211;27;"";LOT;LE HAM DE LA GERE;38780;"";;1;"";;3;Artisan ;4932Z;Transports de voyageurs par taxis;2015;00;NN;20150701;2015;1;201508;"";"";"";P;S;0;O;"";;ADJAMIAN*DANIEL/;"";1;"";"";4932Z;Transports de voyageurs par taxis;2015;"";00;NN;2015;"";20150701;201508;"";S;O;"";"";"";"";"";"";"";;;;84;38318;E;"";1;"";"";27/02/2018
81861326700017;MONSIEUR DAMIEN VIVIER BOUDRIER;"";"";144 IMPASSE LAVERLOCHERE;"";38780 PONT EVEQUE;FRANCE;84;38;3;27;318;PONT EVEQUE;00;243800455;5;56;;21;8211;144;"";IMP;LAVERLOCHERE;38780;"";;1;"";;3;Artisan ;3313Z;Réparation de matériels électroniques et optiques;2016;00;NN;20160215;2016;1;201602;"";"";"";P;S;0;O;"";;VIVIER-BOUDRIER*DAMIEN/;"";1;"";"";3313Z;Réparation de matériels électroniques et optiques;2016;"";00;NN;2016;"";20160215;201602;1;S;O;"";"";"";"";"";"";"";;;;84;38318;E;"";1;"";"";27/02/2018
81978968600014;MONSIEUR LOIC GALVANE;"";"";15 RUE LOUIS LEYDIER;"";38780 PONT EVEQUE;FRANCE;84;38;3;27;318;PONT EVEQUE;00;243800455;5;56;;21;8211;15;"";RUE;LOUIS LEYDIER;38780;"";;1;"";;3;Artisan ;4322A;Travaux d'installation d'eau et de gaz en tous locaux;2016;00;NN;20160425;2016;1;201604;14;91;"";P;S;0;O;"";;GALVANE*LOIC/;"";1;"";"";4322A;Travaux d'installation d'eau et de gaz en tous locaux;2016;4322AZ;00;NN;2016;"";20160425;201604;1;S;O;"";"";"";"";"";"";"";;;;84;38318;E;"";1;"";"";27/02/2018
82084581600025;SEVAN;OLYMPIA;"";RUE RENE SIBILLE;"";38780 PONT EVEQUE;"";84;38;3;27;318;PONT EVEQUE;00;243800455;5;56;;21;8211;"";"";RUE;RENE SIBILLE;38780;"";;1;OLYMPIA;;"";"";9311Z;Gestion d'installations sportives;2017;00;NN;20170201;2017;1;201702;"";"";"";P;S;0;O; ;;SEVAN;"";"";5710;SAS, société par actions simplifiée;9311Z;Gestion d'installations sportives;2017;"";00;NN;2017;"";20160609;201606;"";S;O;"";"";"";"";"";"";"";;;;84;38318;C;"";1;"";"";27/02/2018
82430020600011;GARRIVIER - MASSOT;"";"";21 CHE DU PLAN ET DE LA FEYTA;"";38780 PONT EVEQUE;"";84;38;3;27;318;PONT EVEQUE;00;243800455;5;56;;21;8211;21;"";CHE;DU PLAN ET DE LA FEYTA;38780;"";;1;"";;"";"";7010Z;Activités des sièges sociaux;2016;NN;NN;20161208;"";"";201612;"";"";"";P;S;0;O;"";;GARRIVIER - MASSOT;"";"";5710;SAS, société par actions simplifiée;0000Z;En attente de chiffrement sans activité;2016;"";NN;NN;"";"";20161208;201612;"";S;N;"";"";"";"";"";"";"";;;;84;38318;I;"";1;"";"";27/02/2018
82430020600011;GARRIVIER - MASSOT;"";"";21 CHE DU PLAN ET DE LA FEYTA;"";38780 PONT EVEQUE;"";84;38;3;27;318;PONT EVEQUE;00;243800455;5;56;;21;8211;21;"";CHE;DU PLAN ET DE LA FEYTA;38780;"";;1;"";;"";"";4399C;Travaux de maçonnerie générale et gros oeuvre de bâtiment;2017;NN;NN;20161208;"";3;201612;14;91;"";P;S;0;O; ;;GARRIVIER - MASSOT;"";"";5710;SAS, société par actions simplifiée;4399C;Travaux de maçonnerie générale et gros oeuvre de bâtiment;2017;4399CZ;NN;NN;"";"";20161208;201612;"";S;O;"";"";"";"";"";"";"";;;;84;38318;F;1;1;1;1;27/02/2018
31554935201367;ADREXO;PROSPECTUS MAILING ADRESSE BAL GEOMARK;"";ZONE ARTISANALE LA LUNE;"";38121 REVENTIN VAUGRIS;FRANCE;84;38;3;28;336;REVENTIN VAUGRIS;00;243800455;5;56;;14;8211;"";"";"";ZONE ARTISANALE LA LUNE;38121;"";;0;"";;"";"";7311Z;Activités des agences de publicité;2008;22;100;19930901;2015;9;201209;NR;99;"";P;S;0;O;"";;ADREXO;"";"";5720;Société par actions simplifiée à associé unique ou société par actions simplifiée unipersonnelle ;7311Z;Activités des agences de publicité;2008;"";53;20400;2015;GE;19790101;201209;2;S;O;2012;9;7311Z;7311Z;"";"";"";;;;93;38336;I;"";1;"";"";27/02/2018
31554935201367;ADREXO;PROSPECTUS MAILING ADRESSE BAL GEOMARK;"";ZONE ARTISANALE LA LUNE;"";38121 REVENTIN VAUGRIS;FRANCE;84;38;3;28;336;REVENTIN VAUGRIS;00;243800455;5;56;;14;8211;"";"";"";ZONE ARTISANALE LA LUNE;38121;"";;0;"";;"";"";7311Z;Activités des agences de publicité;2008;22;100;19930901;2015;9;201209;NR;99;"";P;S;0;O; ;;ADREXO;"";"";5720;Société par actions simplifiée à associé unique ou société par actions simplifiée unipersonnelle ;6420Z;Activités des sociétés holding;2017;"";53;20400;2015;GE;19790101;201209;2;S;O;2012;9;7311Z;7311Z;"";"";"";;;;93;38336;F;0;1;0;1;27/02/2018
31949150200062;TRANS SUD;"";ZI VAUGRIS;372 RTE DU BARRAGE;"";38121 REVENTIN VAUGRIS;"";84;38;3;28;336;REVENTIN VAUGRIS;00;243800455;5;56;;14;8211;372;"";RTE;DU BARRAGE;38121;"";;1;"";;"";"";4941A;Transports routiers de fret interurbains;2017;02;NN;20170120;2017;1;201702;"";"";"";P;S;0;O; ;;TRANS SUD;"";"";5710;SAS, société par actions simplifiée;4941A;Transports routiers de fret interurbains;2008;"";02;3;2015;PME;19800701;201209;1;S;O;"";"";"";"";"";"";"";;;;84;38336;C;"";1;"";"";27/02/2018
32337681405401;BROSSETTE;"";"";ROUTE NATIONALE 7;"";38121 REVENTIN VAUGRIS;FRANCE;84;38;3;28;336;REVENTIN VAUGRIS;00;243800455;5;56;;14;8211;"";"";"";RN 7;38121;"";;0;BROSSETTE;;"";"";6820B;Location de terrains et d'autres biens immobiliers;2015;03;6;20051001;2014;1;201209;"";"";"";P;S;0;O;2;;BROSSETTE;"";"";5720;Société par actions simplifiée à associé unique ou société par actions simplifiée unipersonnelle ;4674B;Commerce de gros de fournitures pour la plomberie et le chauffage;2008;"";00;0;2015;ETI;19760212;201209;4;S;O;2012;9;4674B;4674B;4673B;4674A;4669A;;;;84;38336;I;"";1;"";"";27/02/2018
32337681405401;BROSSETTE;"";"";ROUTE NATIONALE 7;"";38121 REVENTIN VAUGRIS;FRANCE;84;38;3;28;336;REVENTIN VAUGRIS;00;243800455;5;56;;14;8211;"";"";"";RN 7;38121;"";;0;BROSSETTE;;"";"";6820B;Location de terrains et d'autres biens immobiliers;2015;03;6;20051001;2014;1;201209;"";"";"";P;S;0;O; ;;BROSSETTE;"";"";5720;Société par actions simplifiée à associé unique ou société par actions simplifiée unipersonnelle ;6820B;Location de terrains et d'autres biens immobiliers;2015;"";00;0;2015;ETI;19760212;201209;4;S;O;2012;9;4674B;4674B;4673B;4674A;4669A;;;;84;38336;F;0;1;0;1;27/02/2018
51240647100049;MADAME ANDREA CAFFERY;"";"";2567 CHEMIN DE L AUBRESSIN;"";38121 REVENTIN VAUGRIS;FRANCE;84;38;3;28;336;REVENTIN VAUGRIS;00;243800455;5;56;;14;8211;2567;"";CHE;DE L'AUBRESSIN;38121;"";;1;"";;2;Commerçant ;4781Z;Commerce de détail alimentaire sur éventaires et marchés;2017;00;NN;20170125;2017;1;201702;10;92;"";P;S;0;O; ;;CAFFERY*ANDREA AMANDINE MAITE/;"";2;"";"";4781Z;Commerce de détail alimentaire sur éventaires et marchés;2017;"";00;NN;2017;"";20090515;201702;"";S;O;"";"";"";"";"";"";"";;;;84;38336;C;"";1;"";"";27/02/2018
79454312400059;MADAME MARIE MAURIN;"";LOTISSEMENT LE PRE FLEURI;146 IMPASSE DU FORT;"";38121 REVENTIN VAUGRIS;FRANCE;84;38;3;28;336;REVENTIN VAUGRIS;00;243800455;5;56;;14;8211;146;"";IMP;DU FORT;38121;"";;1;"";;5;Profession libérale ;8690F;Activités de santé humaine non classées ailleurs;2016;00;NN;20161221;2016;1;201702;"";"";"";P;S;0;O; ;;CINTAS*MAURIN/MARIE/;"";2;"";"";8690F;Activités de santé humaine non classées ailleurs;2013;"";00;NN;2016;PME;20130728;201307;1;S;O;"";"";"";"";"";"";"";;;;84;38336;C;"";1;"";"";27/02/2018
79840674000026;CAP RENOVATION BATIMENT;"";"";847 CHE DE L'AUBRESSIN;"";38121 REVENTIN VAUGRIS;"";84;38;3;28;336;REVENTIN VAUGRIS;00;243800455;5;56;;14;8211;847;"";CHE;DE L'AUBRESSIN;38121;"";;1;"";;"";"";4322A;Travaux d'installation d'eau et de gaz en tous locaux;2016;01;NN;20160901;2016;1;201702;"";"";"";P;S;0;O; ;;CAP RENOVATION BATIMENT;"";"";5498;SARL unipersonnelle ;4322A;Travaux d'installation d'eau et de gaz en tous locaux;2013;4322AZ;01;1;2015;PME;20131024;201311;1;S;O;"";"";"";"";"";"";"";;;;84;38336;C;"";1;"";"";27/02/2018
75167362500024;MADAME CLAIRE GRINGORE;"";"";66 IMP DE LA BOURGEAT;"";38200 SAINT SORLIN DE VIENNE;"";84;38;3;28;459;SAINT SORLIN DE VIENNE;"";243800455;0;"";;12;8211;66;"";IMP;DE LA BOURGEAT;38200;"";;1;"";;9;Autre entrepreneur individuel;9003A;Création artistique relevant des arts plastiques;2017;00;NN;20170101;2017;1;201702;"";"";"";P;S;0;O; ;;GRINGORE*CLAIRE MARIE-JEANNE/;"";2;"";"";9003A;Création artistique relevant des arts plastiques;2011;"";00;NN;2011;PME;20111201;201209;"";S;O;"";"";"";"";"";"";"";;;;84;38459;C;"";1;"";"";27/02/2018
82535619900018;ASS COMMUNALE CHASSE ST SORLIN-DE-VIEN;"";MAIRIE DE SAINT-SORLIN-DE-VIENNE;"";"";38200 SAINT SORLIN DE VIENNE;"";84;38;3;28;459;SAINT SORLIN DE VIENNE;"";243800455;0;"";;12;8211;"";"";"";"";38200;"";;1;"";;"";"";9319Z;Autres activités liées au sport;1964;00;NN;19640710;1964;1;201702;99;99;"";P;S;0;N; ;;ASSOCIATION COMMUNALE DE CHASSE AGREEE DE ST SORLIN-DE-VIENNE;"";"";9220;Association déclarée ;9319Z;Autres activités liées au sport;1964;"";00;NN;1964;"";19640710;201702;"";S;N;"";"";"";"";"";"";"";;;;84;38459;C;"";1;"";"";27/02/2018
82762077400014;OZONE;"";"";124 CHE GABELETTE MALATRA HAUT;"";38200 SAINT SORLIN DE VIENNE;"";84;38;3;28;459;SAINT SORLIN DE VIENNE;"";243800455;0;"";;12;8211;124;"";CHE;GABELETTE MALATRA HAUT;38200;"";;1;"";;"";"";6820B;Location de terrains et d'autres biens immobiliers;2017;00;NN;20170210;2017;NR;201702;NR;NR;"";P;S;0;N; ;;OZONE;"";"";6540;Société civile immobilière ;6820B;Location de terrains et d'autres biens immobiliers;2017;"";00;NN;2017;"";20170210;201702;"";S;N;"";"";"";"";"";"";"";;;;84;38459;C;"";0;"";"";27/02/2018
82772503700010;QUALI CVC;"";"";46 LOTISSEMENT LES CHENES;"";38200 ST SORLIN DE VIENNE;FRANCE;84;38;3;28;459;SAINT SORLIN DE VIENNE;"";243800455;0;"";;12;8211;46;"";LOT;LES CHENES;38200;"";;1;"";;"";"";4322B;Travaux d'installation équipements thermiques et climatisation;2017;01;NN;20170127;2017;1;201702;06;91;"";P;S;0;O; ;;QUALI CVC;"";"";5720;Société par actions simplifiée à associé unique ou société par actions simplifiée unipersonnelle ;4322B;Travaux d'installation équipements thermiques et climatisation;2017;"";01;NN;2017;"";20170127;201702;"";S;O;"";"";"";"";"";"";"";;;;84;38459;C;"";1;"";"";27/02/2018
39186059000028;MONSIEUR LAURENT BERTHIER;BLIP;BARATON;92 IMP DU PALAIS;"";38780 SEPTEME;"";84;38;3;27;480;SEPTEME;"";243800455;0;"";;14;8211;92;"";IMP;DU PALAIS;38780;"";;1;"";;3;Artisan ;4331Z;Travaux de plâtrerie;2008;00;NN;20050616;2005;1;201702;12;91;"";P;S;0;O; ;;BERTHIER*LAURENT/;"";1;"";"";4331Z;Travaux de plâtrerie;2008;4331ZB;00;NN;2005;"";19930712;201702;"";S;O;"";"";"";"";"";"";"";;;;84;38480;C;"";1;"";"";27/02/2018
44997281900030;MADAME CECILE HERNANDEZ;"";"";28 RUE JEAN BAPTISTE BARDIN;"";38780 SEPTEME;FRANCE;84;38;3;27;480;SEPTEME;"";243800455;0;"";;14;8211;28;"";RUE;JEAN BAPTISTE BADIN;38780;"";;1;"";;5;Profession libérale ;8690E;Activité profess. rééducation appareillage & pédicures-podologues;2011;00;NN;20110301;2011;1;201209;"";"";"";P;S;0;O;"";;HERNANDEZ*CECILE/;"";2;"";"";8690E;Activité profess. rééducation appareillage & pédicures-podologues;2008;"";00;0;2004;PME;20030707;201209;1;S;O;"";"";"";"";"";"";"";;;;84;38480;I;"";1;"";"";27/02/2018
44997281900030;MADAME CECILE HERNANDEZ;"";"";28 RUE JEAN BAPTISTE BADIN;"";38780 SEPTEME;"";84;38;3;27;480;SEPTEME;"";243800455;0;"";;14;8211;28;"";RUE;JEAN BAPTISTE BADIN;38780;"";;1;"";;5;Profession libérale ;8690E;Activité profess. rééducation appareillage & pédicures-podologues;2011;00;NN;20110301;2011;1;201209;"";"";"";P;S;0;O; ;;HERNANDEZ*CECILE/;"";2;"";"";8690E;Activité profess. rééducation appareillage & pédicures-podologues;2008;"";00;0;2004;PME;20030707;201209;1;S;O;"";"";"";"";"";"";"";;;;84;38480;F;0;1;0;0;27/02/2018
48999997900029;MONSIEUR FREDERIC MILLION;MILLION FREDERIC;"";1404 ROUTE DE LA ROSIERE;"";38780 SEPTEME;FRANCE;84;38;3;27;480;SEPTEME;"";243800455;0;"";;14;8211;1404;"";"";ROUTE DE LA ROSIERE;38780;"";;1;"";;3;Artisan ;4331Z;Travaux de plâtrerie;2017;00;NN;20170206;2017;1;201702;14;91;"";P;S;0;O; ;;MILLION*FREDERIC/;"";1;"";"";4331Z;Travaux de plâtrerie;2017;4331ZB;00;NN;2017;"";20060522;201702;"";S;O;"";"";"";"";"";"";"";;;;84;38480;C;"";1;"";"";27/02/2018
78885443800025;FRANI;"";"";408 CHEMIN DE LA MANCHE;"";38780 SEPTEME;FRANCE;84;38;3;27;480;SEPTEME;"";243800455;0;"";;14;8211;408;"";CHE;DE LA MANCHE;38780;"";;1;"";;"";"";4321A;Travaux d'installation électrique dans tous locaux;2015;00;NN;20150224;2015;1;201504;"";"";"";P;S;0;O;"";;FRANI;"";"";5499;Société à responsabilité limitée (sans autre indication);4321A;Travaux d'installation électrique dans tous locaux;2012;4321AB;00;NN;2015;PME;20121008;201209;1;S;O;"";"";"";"";"";"";"";;;;84;38480;E;"";1;"";"";27/02/2018
78885443800033;FRANI;"";"";55 CHE DE LA CHARBONNIERE;"";38780 SEPTEME;"";84;38;3;27;480;SEPTEME;"";243800455;0;"";;14;8211;55;"";CHE;DE LA CHARBONNIERE;38780;"";;1;"";;"";"";4321A;Travaux d'installation électrique dans tous locaux;2016;00;NN;20161206;2016;1;201702;"";"";"";P;S;0;O; ;;FRANI;"";"";5499;Société à responsabilité limitée (sans autre indication);4321A;Travaux d'installation électrique dans tous locaux;2012;4321AB;00;NN;2015;PME;20121008;201209;1;S;O;"";"";"";"";"";"";"";;;;84;38480;C;"";1;"";"";27/02/2018
80755358100016;REUSSIR SAVOIE;"";"";156 CHEMIN DE DAMARY;"";38780 SEPTEME;FRANCE;84;38;3;27;480;SEPTEME;"";243800455;0;"";;14;8211;156;"";CHE;DE DAMARY;38780;"";;1;"";;"";"";8559B;Autres enseignements;2014;00;NN;20141103;2014;1;201411;12;93;"";P;S;0;O;"";;REUSSIR SAVOIE;RS;"";5499;Société à responsabilité limitée (sans autre indication);8559B;Autres enseignements;2014;"";00;NN;2014;PME;20141103;201411;1;S;O;"";"";"";"";"";"";"";;;;84;38480;E;"";1;"";"";27/02/2018
81464723600029;MADAME CAMILLE OPINEL;CLEM CAMILLE LEGER ELECTRICITE MULTISE;"";351 RTE DES REMPARTS;"";38780 SEPTEME;"";84;38;3;27;480;SEPTEME;"";243800455;0;"";;14;8211;351;"";RTE;DES REMPARTS;38780;"";;1;"";;3;Artisan ;4321A;Travaux d'installation électrique dans tous locaux;2016;00;NN;20160923;2016;1;201702;"";"";"";P;S;0;O; ;;LEGER*OPINEL/CAMILLE/;"";2;"";"";4321A;Travaux d'installation électrique dans tous locaux;2015;4321AB;00;NN;2015;"";20151109;201511;1;S;O;"";"";"";"";"";"";"";;;;84;38480;C;"";1;"";"";27/02/2018
82756187900012;MADAME MORGANE VIDAL;BULLES DE DOUCEUR;"";55 CHE DE LA CHARBONNIERE;"";38780 SEPTEME;"";84;38;3;27;480;SEPTEME;"";243800455;0;"";;14;8211;55;"";CHE;DE LA CHARBONNIERE;38780;"";;1;"";;1;Artisan-commerçant ;9602B;Soins de beauté;2017;NN;NN;20170206;"";1;201702;12;93;"";P;S;0;O; ;;VIDAL*MORGANE PASCALE/;"";2;"";"";9602B;Soins de beauté;2017;9602BB;NN;NN;"";"";20170206;201702;"";S;O;"";"";"";"";"";"";"";;;;84;38480;C;"";1;"";"";27/02/2018
34773109300030;MONSIEUR JACQUES LAFALLISSE;"";"";2197 LIEUDIT PAUPHILE;"";38200 SEYSSUEL;FRANCE;84;38;3;27;487;SEYSSUEL;00;243800455;5;56;;15;8211;2197;"";"";"LIEUDIT ""PAUPHILE""";38200;"";;1;"";;5;Profession libérale ;7022Z;Conseil pour les affaires et autres conseils de gestion;2010;00;NN;20060401;2006;1;201209;"";"";"";P;S;0;O;"";;LAFALLISSE*JACQUES HYACINTHE LOUIS/;"";1;"";"";7022Z;Conseil pour les affaires et autres conseils de gestion;2010;"";00;NN;2006;PME;19880701;201209;1;S;O;"";"";"";"";"";"";"";;;;84;38487;I;"";1;"";"";27/02/2018
34773109300030;MONSIEUR JACQUES LAFALLISSE;PAUPHILE;BATIMENT L;2197 ROUTE NATIONALE 7;"";38200 SEYSSUEL;FRANCE;84;38;3;27;487;SEYSSUEL;00;243800455;5;56;;15;8211;2197;"";RTE;NATIONALE 7;38200;"";;1;"";;5;Profession libérale ;7022Z;Conseil pour les affaires et autres conseils de gestion;2010;00;NN;20060401;2006;1;201209;"";"";"";P;S;0;O; ;;LAFALLISSE*JACQUES HYACINTHE LOUIS/;"";1;"";"";7022Z;Conseil pour les affaires et autres conseils de gestion;2010;"";00;NN;2006;PME;19880701;201209;1;S;O;"";"";"";"";"";"";"";;;;84;38487;F;0;1;0;0;27/02/2018
44280769900032;MONSIEUR MICHEL AMICO;J R J AMICO M;"";255 RUE DU CHATEAU PICARD;"";38200 SEYSSUEL;FRANCE;84;38;3;27;487;SEYSSUEL;00;243800455;5;56;;15;8211;255;"";RUE;DU CHATEAU PICARD;38200;"";;1;"";;3;Artisan ;4331Z;Travaux de plâtrerie;2013;00;NN;20131118;2013;1;201312;"";"";"";P;S;0;O;"";;AMICO*MICHEL/;"";1;"";"";4331Z;Travaux de plâtrerie;2008;"";00;NN;2013;PME;20020716;201209;1;S;O;"";"";"";"";"";"";"";;;;84;38487;I;"";1;"";"";27/02/2018
44280769900032;MONSIEUR MICHEL AMICO;J.R.J. AMICO M.;"";255 RUE DU CHATEAU PICARD;"";38200 SEYSSUEL;"";84;38;3;27;487;SEYSSUEL;00;243800455;5;56;;15;8211;255;"";RUE;DU CHATEAU PICARD;38200;"";;1;"";;3;Artisan ;4333Z;Travaux de revêtement des sols et des murs;2017;00;NN;20131118;2013;1;201312;14;91;"";P;S;0;O; ;;AMICO*MICHEL/;"";1;"";"";4333Z;Travaux de revêtement des sols et des murs;2017;4331ZB;00;NN;2013;PME;20020716;201209;1;S;O;"";"";"";"";"";"";"";;;;84;38487;F;1;1;1;1;27/02/2018
48027623700058;MADAME AURELIE FOSSE;"";"";11 CHEMIN DES ALEXANDRINES;"";38200 SEYSSUEL;FRANCE;84;38;3;27;487;SEYSSUEL;00;243800455;5;56;;15;8211;11;"";CHE;DES ALEXANDRINES;38200;"";;0;"";;5;Profession libérale ;8690E;Activité profess. rééducation appareillage & pédicures-podologues;2015;00;NN;20150401;2015;1;201606;"";"";"";P;S;0;O;"";;FOSSE*AURELIE/;"";2;"";"";8690E;Activité profess. rééducation appareillage & pédicures-podologues;2008;"";00;NN;2007;PME;20041122;201209;1;S;O;"";"";"";"";"";"";"";;;;84;38487;I;"";1;"";"";27/02/2018
48027623700058;MADAME AURELIE FOSSE;"";"";11 CHE DES ALEXANDRINES;"";38200 SEYSSUEL;"";84;38;3;27;487;SEYSSUEL;00;243800455;5;56;;15;8211;11;"";CHE;DES ALEXANDRINES;38200;"";;1;"";;5;Profession libérale ;8690E;Activité profess. rééducation appareillage & pédicures-podologues;2015;00;NN;20150401;2015;1;201606;"";"";"";P;S;0;O; ;;FOSSE*AURELIE/;"";2;"";"";8690E;Activité profess. rééducation appareillage & pédicures-podologues;2008;"";00;NN;2007;PME;20041122;201209;1;S;O;"";"";"";"";"";"";"";;;;84;38487;F;0;1;0;0;27/02/2018
82408974200012;SC QUENTIN NARIND;"";"";180 CHEMIN DES ALEXANDRINES;"";38200 SEYSSUEL;FRANCE;84;38;3;27;487;SEYSSUEL;00;243800455;5;56;;15;8211;180;"";CHE;DES ALEXANDRINES;38200;"";;1;"";;"";"";7010Z;Activités des sièges sociaux;2016;00;NN;20161121;2016;NR;201612;99;99;"";P;S;0;O;"";;SC QUENTIN NARIND;"";"";6599;Autre société civile ;7010Z;Activités des sièges sociaux;2016;"";00;NN;2016;"";20161121;201612;"";S;O;"";"";"";"";"";"";"";;;;84;38487;I;"";1;"";"";27/02/2018
82408974200012;SC QUENTIN NARIND;"";"";180 CHE DES ALEXANDRINES;"";38200 SEYSSUEL;"";84;38;3;27;487;SEYSSUEL;00;243800455;5;56;;15;8211;180;"";CHE;DES ALEXANDRINES;38200;"";;1;"";;"";"";6420Z;Activités des sociétés holding;2016;00;NN;20161121;2016;NR;201612;99;99;"";P;S;0;O; ;;SC QUENTIN NARIND;"";"";6599;Autre société civile ;6420Z;Activités des sociétés holding;2016;"";00;NN;2016;"";20161121;201612;"";S;O;"";"";"";"";"";"";"";;;;84;38487;F;0;0;1;1;27/02/2018
82786448900014;MADAME MAUREEN MONNET;"";"";CHEMIN DES CORNEES;"";38200 SEYSSUEL;FRANCE;84;38;3;27;487;SEYSSUEL;00;243800455;5;56;;15;8211;"";"";"";CHEMIN DES CROZES;38200;"";;1;"";;5;Profession libérale ;7219Z;Recherche-développement : autres sciences physiques et naturelles;2017;00;NN;20170202;2017;1;201702;"";"";"";P;S;0;O; ;;MONNET*MAUREEN/;"";2;"";"";7219Z;Recherche-développement : autres sciences physiques et naturelles;2017;"";00;NN;2017;"";20170202;201702;"";S;O;"";"";"";"";"";"";"";;;;84;38487;C;"";1;"";"";27/02/2018
18693000400251;CCI REGION RHONE ALPES;CCI NORD ISERE;"";2 PLACE SAINT PIERRE;CS 209;38200 VIENNE;FRANCE;84;38;3;99;544;VIENNE;00;243800455;5;56;;42;8211;2;"";PL;SAINT PIERRE;38200;"";;0;CCI NORD ISERE;;"";"";9411Z;Activités des organisations patronales et consulaires;2013;22;100;20130101;2015;1;201209;"";"";"";P;S;0;N;"";;CHAMBRE DE COMMERCE ET D INDUSTRIE DE REGION RHONE ALPES;CCIR;"";7381;Organisme consulaire ;9411Z;Activités des organisations patronales et consulaires;2008;"";51;2500;2015;ETI;19830316;201209;3;S;N;"";"";"";"";"";"";"";;;;84;38544;E;"";1;"";"";27/02/2018
30970699200885;GINGER;SUD EXPRESS;"";17 RUE DES ORFEVRES;"";38200 VIENNE;"";84;38;3;99;544;VIENNE;00;243800455;5;56;;42;8211;17;"";RUE;DES ORFEVRES;38200;"";;0;SUD EXPRESS;;"";"";4771Z;Commerce de détail d'habillement en magasin spécialisé;2017;00;NN;20170117;2017;3;201702;NR;NR;"";P;S;0;O; ;;GINGER;"";"";5710;SAS, société par actions simplifiée;4771Z;Commerce de détail d'habillement en magasin spécialisé;2012;"";32;300;2015;ETI;19770101;201209;3;S;O;2012;6;4771Z;4771Z;1413Z;4791A;8299Z;;;;11;38544;C;"";1;"";"";27/02/2018
31949150200054;TRANS SUD;"";"";SAINT BENOIT;"";38200 VIENNE;FRANCE;84;38;3;99;544;VIENNE;00;243800455;5;56;;42;8211;"";"";"";SAINT BENOIT;38200;"";;1;"";;"";"";4941A;Transports routiers de fret interurbains;2013;02;3;20130719;2015;9;201308;"";"";"";P;S;0;O;"";;TRANS SUD;"";"";5499;Société à responsabilité limitée (sans autre indication);4941A;Transports routiers de fret interurbains;2008;"";02;3;2015;PME;19800701;201209;1;S;O;"";"";"";"";"";"";"";;;;84;38544;E;"";1;"";"";27/02/2018
32204437100027;H C C B;"";"";10 CHEMIN DE LA RECLUSIERE;"";38200 VIENNE;FRANCE;84;38;3;99;544;VIENNE;00;243800455;5;56;;42;8211;10;"";CHE;DE LA RECLUSIERE;38200;"";;1;"";;"";"";6420Z;Activités des sociétés holding;2014;02;3;20141120;2015;1;201412;"";"";"";P;S;0;O;"";;H.C.C.B.;"";"";5498;SARL unipersonnelle ;6420Z;Activités des sociétés holding;2014;"";02;3;2015;PME;19630101;201209;1;S;O;"";"";"";"";"";"";"";;;;84;38544;I;"";0;"";"";27/02/2018
32204437100027;H.C.C.B.;"";"";10 CHE DE LA RECLUSIERE;"";38200 VIENNE;"";84;38;3;99;544;VIENNE;00;243800455;5;56;;42;8211;10;"";CHE;DE LA RECLUSIERE;38200;"";;1;"";;"";"";6420Z;Activités des sociétés holding;2014;02;3;20141120;2015;1;201412;"";"";"";P;S;0;O; ;;H.C.C.B.;"";"";5498;SARL unipersonnelle ;6420Z;Activités des sociétés holding;2014;"";02;3;2015;PME;19630101;201209;1;S;O;"";"";"";"";"";"";"";;;;84;38544;F;0;0;0;0;27/02/2018
32695965700049;MONSIEUR JEAN BOULLU;"";"";44 RUE BOSON;"";38200 VIENNE;FRANCE;84;38;3;99;544;VIENNE;00;243800455;5;56;;42;8211;44;"";RUE;BOSON;38200;"";;1;"";;5;Profession libérale ;6920Z;Activités comptables;2008;00;0;20030926;2012;9;201209;NR;99;"";P;S;0;O;"";;BOULLU*JEAN MARC/;"";1;"";"";6920Z;Activités comptables;2008;"";00;0;2012;PME;19810801;201209;1;S;O;"";"";"";"";"";"";"";;;;84;38544;E;"";1;"";"";27/02/2018
42935796500053;MONSIEUR LAURENT LIORIT;PCDECLIC;"";50 AVENUE GENERAL LECLERC;"";38200 VIENNE;FRANCE;84;38;3;99;544;VIENNE;00;243800455;5;56;;42;8211;50;"";AV;GAL LECLERC;38200;"";;1;"";;3;Artisan ;6203Z;Gestion d'installations informatiques;2016;00;NN;20161201;2016;1;201702;"";"";"";P;S;0;O; ;;LIORIT*LAURENT YVES ANTOINE/;"";1;"";"";6203Z;Gestion d'installations informatiques;2016;9511ZZ;00;NN;2015;PME;20000201;201508;1;S;O;"";"";"";"";"";"";"";;;;84;38544;C;"";1;"";"";27/02/2018
33247024400929;SOC MENAGER DEFAUTS ASPECTS DISTRI;MDA;"";98 AVENUE GENERAL LECLERC;"";38200 VIENNE;FRANCE;84;38;3;99;544;VIENNE;00;243800455;5;56;;42;8211;98;"";AV;GAL LECLERC;38200;"";;0;MDA;;"";"";4754Z;Commerce de détail appareils électroménagers (magasin spécialisé);2017;01;NN;20170201;2017;3;201702;10;05;"";P;S;0;O; ;;SOCIETE MENAGER EN DEFAUTS D'ASPECTS - DISTRIBUTION (M.D.A. DISTRIBUTION);"";"";5710;SAS, société par actions simplifiée;4754Z;Commerce de détail appareils électroménagers (magasin spécialisé);2008;"";32;200;2015;ETI;19850501;201209;3;S;O;"";"";"";"";"";"";"";;;;84;38544;C;"";1;"";"";27/02/2018
33847958700036;MONSIEUR MARC BEGON;"";"";7 RUE DU COLLEGE;"";38200 VIENNE;FRANCE;84;38;3;99;544;VIENNE;00;243800455;5;56;;42;8211;7;"";RUE;DU COLLEGE;38200;"";;1;"";;9;Autre entrepreneur individuel;9003B;Autre création artistique;2008;01;1;20030101;2015;1;201209;NR;99;"";P;S;0;O;"";;BEGON*MARC PHILIPPE/;"";1;"";"";9003B;Autre création artistique;2008;"";01;1;2015;PME;19841001;201209;1;S;O;"";"";"";"";"";"";"";;;;84;38544;E;"";1;"";"";27/02/2018
34749876800030;COMPOSITION IMPRESSION MARCELIN;"";"";45 RUE VIMAINE;"";38200 VIENNE;"";84;38;3;99;544;VIENNE;00;243800455;5;56;;42;8211;45;"";RUE;VIMAINE;38200;"";;0;"";;"";"";1812Z;Autre imprimerie (labeur);2009;01;1;20091113;2015;1;201209;"";"";"";P;S;0;O; ;;COMPOSITION IMPRESSION MARCELIN;COMIMA;"";5599;SA à conseil d'administration (s.a.i.);1812Z;Autre imprimerie (labeur);2008;1812ZA;01;1;2015;PME;19880601;201209;1;S;O;"";"";"";"";"";"";"";;;;84;38544;E;"";1;"";"";27/02/2018
