41389345400012;RESOCLEAN EUROPE;"";"";ZONE INDUSTRIELLE ;BP 1654;38200 SEYSSUEL;FRANCE;84;38;3;27;487;SEYSSUEL;00;243800455;5;56;;14;8211;"";"";"";ZONE INDUSTRIELLE;38200;"";;1;"";;"";"";3812Z;Collecte des déchets dangereux;2008;01;1;19970901;2015;1;201209;NR;99;"";P;S;0;O; ;;RESOCLEAN  EUROPE;"";"";5720;Société par actions simplifiée à associé unique ou société par actions simplifiée unipersonnelle ;8129B;Autres activités de nettoyage n.c.a.;2008;"";11;10;2015;ETI;19970901;201209;3;S;O;2014;3;8129B;8129B;"";"";"";;;;84;38487;F;0;1;0;1;27/02/2018
41389345400061;RESOCLEAN EUROPE;"";"";LIEU DIT LES GARDIERES;"";38200 SEYSSUEL;FRANCE;84;38;3;27;487;SEYSSUEL;00;243800455;5;56;;14;8211;"";"";LD;LES GARDIERES;38200;"";;0;"";;"";"";3812Z;Collecte des déchets dangereux;2008;02;3;20000328;2015;1;201209;NR;99;"";P;S;0;O;"";;RESOCLEAN  EUROPE;"";"";5498;SARL unipersonnelle ;8129B;Autres activités de nettoyage n.c.a.;2008;"";11;10;2015;ETI;19970901;201209;3;S;O;2014;3;8129B;8129B;"";"";"";;;;84;38487;I;"";1;"";"";27/02/2018
41389345400061;RESOCLEAN EUROPE;"";"";LIEU DIT LES GARDIERES;"";38200 SEYSSUEL;FRANCE;84;38;3;27;487;SEYSSUEL;00;243800455;5;56;;14;8211;"";"";LD;LES GARDIERES;38200;"";;0;"";;"";"";3812Z;Collecte des déchets dangereux;2008;02;3;20000328;2015;1;201209;NR;99;"";P;S;0;O; ;;RESOCLEAN  EUROPE;"";"";5720;Société par actions simplifiée à associé unique ou société par actions simplifiée unipersonnelle ;8129B;Autres activités de nettoyage n.c.a.;2008;"";11;10;2015;ETI;19970901;201209;3;S;O;2014;3;8129B;8129B;"";"";"";;;;84;38487;F;0;1;0;1;27/02/2018
44158788800013;SALTO;"";"";ZONE INDUSTRIELLE ;"";38200 SEYSSUEL;FRANCE;84;38;3;27;487;SEYSSUEL;00;243800455;5;56;;14;8211;"";"";"";ZI;38200;"";;1;"";;"";"";5229B;Affrètement et organisation des transports;2008;02;3;20020222;2004;1;201209;NR;99;"";P;S;0;O;"";;SALTO;"";"";5710;SAS, société par actions simplifiée;5229B;Affrètement et organisation des transports;2008;"";01;1;2015;ETI;20020222;201209;1;S;O;2014;4;5229B;5229B;"";"";"";;;;84;38487;E;"";1;"";"";27/02/2018
81781550900010;MONSIEUR BRUNO JEAN CLAUDE TAORMINA;ELECTRONA EVENTS;"";27 LOTISSEMENT LES AULNES;"";38200 SEYSSUEL;FRANCE;84;38;3;27;487;SEYSSUEL;00;243800455;5;56;;14;8211;27;"";LOT;LES AULNES;38200;"";;1;"";;5;Profession libérale ;8230Z;Organisation de foires, salons professionnels et congrès;2016;00;NN;20160118;2016;1;201601;12;93;"";P;S;0;O;"";;TAORMINA*BRUNO JEAN CLAUDE/;"";1;"";"";8230Z;Organisation de foires, salons professionnels et congrès;2016;"";00;NN;2016;"";20160118;201601;1;S;O;"";"";"";"";"";"";"";;;;84;38487;I;"";1;"";"";27/02/2018
81781550900010;MONSIEUR BRUNO JEAN CLAUDE TAORMINA;ELECTRONA EVENTS;"";27 LOT LES AULNES;"";38200 SEYSSUEL;"";84;38;3;27;487;SEYSSUEL;00;243800455;5;56;;14;8211;27;"";LOT;LES AULNES;38200;"";;1;"";;9;Autre entrepreneur individuel;9329Z;Autres activités récréatives et de loisirs;2017;00;NN;20160118;2016;1;201601;12;93;"";P;S;0;O; ;;TAORMINA*BRUNO JEAN CLAUDE/;"";1;"";"";9329Z;Autres activités récréatives et de loisirs;2017;"";00;NN;2016;"";20160118;201601;1;S;O;"";"";"";"";"";"";"";;;;84;38487;F;0;1;1;1;27/02/2018
81857641500025;MONSIEUR LILIAN MOUNIER;"";"";120 CHEMIN DU SUBELLIN;"";38200 SEYSSUEL;FRANCE;84;38;3;27;487;SEYSSUEL;00;243800455;5;56;;14;8211;120;"";CHE;DU SUBELLIN;38200;"";;1;"";;2;Commerçant ;4619B;Autres intermédiaires du commerce en produits divers;2017;00;NN;20170825;2017;NR;201709;NR;NR;"";P;S;0;O; ;;MOUNIER*LILIAN ANDRE CLAUDE/;"";1;"";"";4619B;Autres intermédiaires du commerce en produits divers;2016;"";00;NN;2017;"";20160211;201709;"";S;O;"";"";"";"";"";"";"";;;;84;38487;C;"";1;"";"";27/02/2018
82217837200014;MADAME MARIE JAC;MARILICE;"";420 CHEMIN DE MONTROZIER;"";38200 SEYSSUEL;FRANCE;84;38;3;27;487;SEYSSUEL;00;243800455;5;56;;14;8211;420;"";CHE;DE MONTROZIER;38200;"";;1;"";;5;Profession libérale ;8219Z;Photocopie prépa. documents & aut. activ. spéc. soutien de bureau;2016;00;NN;20160822;2016;1;201608;12;07;"";P;S;0;O;"";;HERAUD*JAC/MARIE/;"";2;"";"";8219Z;Photocopie prépa. documents & aut. activ. spéc. soutien de bureau;2016;8219ZP;00;NN;2016;"";20160822;201608;1;S;O;"";"";"";"";"";"";"";;;;84;38487;E;"";1;"";"";27/02/2018
82898624000012;EYTIMEY;"";"";211 CHEMIN DU VIEUX CHATEAU;"";38200 SEYSSUEL;FRANCE;84;38;3;27;487;SEYSSUEL;00;243800455;5;56;;14;8211;211;"";CHE;DU VIEUX CHATEAU;38200;"";;1;"";;"";"";4634Z;Commerce de gros (commerce interentreprises) de boissons;2017;00;NN;20170406;2017;1;201704;99;99;"";P;S;0;O;"";;EYTIMEY;"";"";5710;SAS, société par actions simplifiée;4634Z;Commerce de gros (commerce interentreprises) de boissons;2017;"";00;NN;2017;"";20170406;201704;1;S;O;"";"";"";"";"";"";"";;;;84;38487;E;"";1;"";"";27/02/2018
82898624000020;EYTIMEY;EYMIN;"";420 CHEMIN DE MONTROZIER;"";38200 SEYSSUEL;FRANCE;84;38;3;27;487;SEYSSUEL;00;243800455;5;56;;14;8211;420;"";CHE;DE MONTROZIER;38200;"";;1;EYMIN;;"";"";4634Z;Commerce de gros (commerce interentreprises) de boissons;2017;00;NN;20170814;2017;1;201709;"";"";"";P;S;0;O; ;;EYTIMEY;"";"";5499;Société à responsabilité limitée (sans autre indication);4634Z;Commerce de gros (commerce interentreprises) de boissons;2017;"";00;NN;2017;"";20170406;201704;1;S;O;"";"";"";"";"";"";"";;;;84;38487;C;"";1;"";"";27/02/2018
08568004900849;THEODORE MAISON DE PEINTURE;COLORANCE;"";155 CHEMIN DE LA RAVAT;"";38200 VIENNE;FRANCE;84;38;3;99;544;VIENNE;00;243800455;5;56;;42;8211;155;"";CHE;DE LA RAVAT;38200;"";;0;COLORANCE;;"";"";4673B;Commerce de gros d'appareils sanitaires et produits de décoration;2017;00;NN;20170701;2017;3;201709;NR;NR;"";P;S;0;O; ;;THEODORE MAISON DE PEINTURE;"";"";5710;SAS, société par actions simplifiée;4673B;Commerce de gros d'appareils sanitaires et produits de décoration;2008;"";22;100;2015;ETI;19560101;201209;3;S;O;2014;6;4673B;4673B;4674A;4644Z;4673A;;;;32;38544;C;"";1;"";"";27/02/2018
30469946500049;MONSIEUR LOUIS CHAPUIS;"";"";4 PLACE SAINT PIERRE;"";38200 VIENNE;FRANCE;84;38;3;99;544;VIENNE;00;243800455;5;56;;42;8211;4;"";PL;SAINT PIERRE;38200;"";;1;"";;5;Profession libérale ;6910Z;Activités juridiques;2016;00;NN;20140701;2014;1;201709;11;07;"";P;S;0;O; ;;CHAPUIS*LOUIS NOEL AYME/;"";1;"";"";6910Z;Activités juridiques;2016;"";00;NN;2014;"";"";201709;"";S;O;"";"";"";"";"";"";"";;;;84;38544;D;"";1;"";"";27/02/2018
33414300500026;MONSIEUR JACQUES CALMON;"";"";27 RUE DE BOURGOGNE;BP 247;38202 VIENNE CEDEX;FRANCE;84;38;3;99;544;VIENNE;00;243800455;5;56;;42;8211;27;"";RUE;DE BOURGOGNE;38200;38202;;1;"";;5;Profession libérale ;6910Z;Activités juridiques;2008;11;10;19890807;2015;9;201209;NR;99;"";P;S;0;O;"";;CALMON*JACQUES FRANCOIS MARIE/;"";1;"";"";6910Z;Activités juridiques;2008;"";11;10;2015;PME;19830401;201209;1;S;O;"";"";"";"";"";"";"";;;;84;38544;E;"";1;"";"";27/02/2018
33844275900043;ROMA;"";"";2 RUE CHANTELOUVE;"";38200 VIENNE;FRANCE;84;38;3;99;544;VIENNE;00;243800455;5;56;;42;8211;2;"";RUE;CHANTELOUVE;38200;"";;1;"";;"";"";6810Z;Activités des marchands de biens immobiliers;2008;01;1;19950915;2015;9;201209;NR;99;"";P;S;0;O;"";;ROMA;"";"";5499;Société à responsabilité limitée (sans autre indication);6810Z;Activités des marchands de biens immobiliers;2008;"";01;1;2015;PME;19860704;201209;1;S;O;"";"";"";"";"";"";"";;;;84;38544;E;"";1;"";"";27/02/2018
34805684700042;MONSIEUR JEAN FRANCOIS BOISSIER;"";RESIDENCE LE THEATRE;26 RUE DE LA CHARITE;"";38200 VIENNE;FRANCE;84;38;3;99;544;VIENNE;00;243800455;5;56;;42;8211;26;"";RUE;DE LA CHARITE;38200;"";;1;"";;2;Commerçant ;4619B;Autres intermédiaires du commerce en produits divers;2015;00;NN;20150320;2015;NR;201504;NR;NR;"";P;S;0;O;"";;BOISSIER*JEAN-FRANCOIS CHARLES/;"";1;"";"";4619B;Autres intermédiaires du commerce en produits divers;2015;"";00;0;2004;PME;19880803;201504;1;S;O;"";"";"";"";"";"";"";;;;84;38544;E;"";1;"";"";27/02/2018
34960086600041;SONOTRA;SONOTRA;"";840 RUE ST ALBAN;"";38200 VIENNE;"";84;38;3;99;544;VIENNE;00;243800455;5;56;;42;8211;840;"";RUE;ST ALBAN;38200;"";;1;VIENNE;;"";"";4312A;Travaux de terrassement courants et travaux préparatoires;2016;11;NN;20160101;2016;1;201604;"";"";"";P;S;0;O; ;;SONOTRA;"";"";5710;SAS, société par actions simplifiée;4312A;Travaux de terrassement courants et travaux préparatoires;2008;"";11;10;2015;PME;19890112;201604;1;S;O;"";"";"";"";"";"";"";;;;84;38544;E;"";1;"";"";27/02/2018
37976926800010;BRIVIEN;BRICOMARCHE;ZAC DE LA GERE;MALISSOL;"";38200 VIENNE;"";84;38;3;99;544;VIENNE;00;243800455;5;56;;42;8211;"";"";"";MALISSOL;38200;"";;1;"";;"";"";4752B;Comm. détail de quincaillerie, peintures et verres (mag.> 400 m2);2008;11;10;19901024;2015;1;201209;NR;05;3 ;P;S;0;O;"";;BRIVIEN;"";"";5599;SA à conseil d'administration (s.a.i.);4752B;Comm. détail de quincaillerie, peintures et verres (mag.> 400 m2);2008;"";11;10;2015;PME;19901024;201209;1;S;O;"";"";"";"";"";"";"";;;;84;38544;I;"";1;"";"";27/02/2018
37976926800010;BRIVIEN;BRICOMARCHE;MALISSOL MALISSOL;ZONE ARTISANALE DE LA GERE;"";38200 VIENNE;FRANCE;84;38;3;99;544;VIENNE;00;243800455;5;56;;42;8211;"";"";"";MALISSOL;38200;"";;1;BRICOMARCHE;;"";"";4752B;Comm. détail de quincaillerie, peintures et verres (mag.> 400 m2);2008;11;10;19901024;2015;1;201209;NR;05;3 ;P;S;0;O; ;;BRIVIEN;"";"";5710;SAS, société par actions simplifiée;4752B;Comm. détail de quincaillerie, peintures et verres (mag.> 400 m2);2008;"";11;10;2015;PME;19901024;201209;1;S;O;"";"";"";"";"";"";"";;;;84;38544;F;0;1;0;1;27/02/2018
38098813900024;SCI DE LA BARRE;"";"";128 AVENUE GENERAL LECLERC;"";38200 VIENNE;FRANCE;84;38;3;99;544;VIENNE;00;243800455;5;56;;42;8211;128;"";AV;GAL LECLERC;38200;"";;1;"";;"";"";4110D;Supports juridiques de programmes;2017;00;NN;20170901;2017;NR;201709;"";"";"";P;S;0;O; ;;SCI DE LA BARRE;"";"";6540;Société civile immobilière ;4110D;Supports juridiques de programmes;2017;"";00;0;2004;"";19910101;201209;1;S;O;"";"";"";"";"";"";"";;;;84;38544;C;"";0;"";"";27/02/2018
38837932300024;MADAME JOELLE TRICAUD;PHARMACIE DU COURS;"";41 COURS BRILLIER;"";38200 VIENNE;FRANCE;84;38;3;99;544;VIENNE;00;243800455;5;56;;42;8211;41;"";CRS;BRILLIER;38200;"";;1;"";;2;Commerçant ;4773Z;Commerce de détail produits pharmaceutiques (magasin spécialisé);2008;03;6;20041001;2015;3;201209;NR;05;1 ;P;S;0;O;"";;COCHET*TRICAUD/JOELLE/;"";2;"";"";4773Z;Commerce de détail produits pharmaceutiques (magasin spécialisé);2008;"";03;6;2015;PME;19920301;201209;1;S;O;"";"";"";"";"";"";"";;;;84;38544;E;"";0;"";"";27/02/2018
41086873100044;MADAME DOMINIQUE OLAGNON;"";"";1 B PL DE LA FERME;"";38200 VIENNE;"";84;38;3;99;544;VIENNE;00;243800455;5;56;;42;8211;1;B;PL;DE LA FERME;38200;"";;1;"";;5;Profession libérale ;8621Z;Activité des médecins généralistes;2008;00;NN;20070801;2007;1;201209;"";"";"";P;S;0;O;"";;GERMAIN*OLAGNON/DOMINIQUE CECILE/;"";2;"";"";8621Z;Activité des médecins généralistes;2008;"";00;0;2004;PME;19961221;201209;1;S;O;"";"";"";"";"";"";"";;;;84;38544;E;"";1;"";"";27/02/2018
43036755700021;LE PETIT TRAIN DE VIENNE;ESPACE ST GERMAIN;"";30 AVENUE GENERAL LECLERC;"";38200 VIENNE;FRANCE;84;38;3;99;544;VIENNE;00;243800455;5;56;;42;8211;30;"";AV;GAL LECLERC;38200;"";;0;"";;"";"";4939B;Autres transports routiers de voyageurs;2008;00;0;20010110;2004;9;201209;NR;99;"";P;S;0;O;"";;LE PETIT TRAIN DE VIENNE;LPTDV;"";5498;SARL unipersonnelle ;4939B;Autres transports routiers de voyageurs;2008;"";00;0;2014;PME;20000515;201209;1;S;O;"";"";"";"";"";"";"";;;;84;38544;E;"";1;"";"";27/02/2018
44799568900075;MONSIEUR ABDELKADER BOUSSAHA;AB2C;"";1012 GRAPILLAT DE COUPE JARRET;"";38200 VIENNE;"";84;38;3;99;544;VIENNE;00;243800455;5;56;;42;8211;1012;"";"";GRAPILLAT DE COUPE JARRET;38200;"";;1;"";;3;Artisan ;4391A;Travaux de charpente;2017;00;NN;20170908;2017;1;201709;14;91;"";P;S;0;O; ;;BOUSSAHA*ABDELKADER/;"";1;"";"";4391A;Travaux de charpente;2017;4391AZ;00;NN;2017;"";20030402;201709;"";S;O;"";"";"";"";"";"";"";;;;84;38544;C;"";1;"";"";27/02/2018
44959869700026;MADAME GAETANE LEFRANC;"";"";4 IMPASSE SAINT ANDRE LE HAUT;"";38200 VIENNE;FRANCE;84;38;3;99;544;VIENNE;00;243800455;5;56;;42;8211;4;"";IMP;DE ST ANDRE LE HAUT;38200;"";;1;"";;9;Artisan ;7420Z;Activités photographiques;2009;00;NN;20090919;2009;9;201209;"";"";"";P;S;0;O;"";;LEFRANC*GAETANE/;"";2;"";"";7420Z;Activités photographiques;2009;"";00;0;2004;PME;20030801;201209;1;S;O;"";"";"";"";"";"";"";;;;84;38544;E;"";1;"";"";27/02/2018
48365629400020;GM INFO;"";"";4 RUE PAUL CEZANNE;"";38200 VIENNE;FRANCE;84;38;3;99;544;VIENNE;00;243800455;5;56;;42;8211;4;"";RUE;PAUL CEZANNE;38200;"";;1;"";;"";"";6202A;Conseil en systèmes et logiciels informatiques;2008;01;1;20071026;2015;1;201209;"";"";"";P;S;0;O;"";;GM INFO;"";"";5720;Société par actions simplifiée à associé unique ou société par actions simplifiée unipersonnelle ;6202A;Conseil en systèmes et logiciels informatiques;2008;"";01;1;2015;PME;20050808;201209;1;S;O;"";"";"";"";"";"";"";;;;84;38544;I;"";1;"";"";27/02/2018
48365629400020;GM INFO;"";"";4 RUE PAUL CEZANNE;"";38200 VIENNE;"";84;38;3;99;544;VIENNE;00;243800455;5;56;;42;8211;4;"";RUE;PAUL CEZANNE;38200;"";;1;"";;"";"";6202A;Conseil en systèmes et logiciels informatiques;2008;01;1;20071026;2015;1;201209;"";"";"";P;S;0;O; ;;GM INFO;"";"";5720;Société par actions simplifiée à associé unique ou société par actions simplifiée unipersonnelle ;6202A;Conseil en systèmes et logiciels informatiques;2008;"";01;1;2015;PME;20050808;201209;1;S;O;"";"";"";"";"";"";"";;;;84;38544;F;0;1;0;0;27/02/2018
48977575900033;MADAME ALEXANDRA COHEN SCALI;"";"";9 RUE PEYRON;"";38200 VIENNE;"";84;38;3;99;544;VIENNE;00;243800455;5;56;;42;8211;9;"";RUE;PEYRON;38200;"";;1;"";;5;Profession libérale ;6910Z;Activités juridiques;2010;00;NN;20100201;2010;1;201209;"";"";"";P;S;0;O; ;;COHEN SCALI*STORA/ALEXANDRA SARAH/;"";2;"";"";6910Z;Activités juridiques;2008;"";00;NN;2010;PME;20060401;201209;1;S;O;"";"";"";"";"";"";"";;;;84;38544;I;"";1;"";"";27/02/2018
48977575900033;MADAME ALEXANDRA COHEN SCALI;"";"";9 RUE PEYRON;"";38200 VIENNE;"";84;38;3;99;544;VIENNE;00;243800455;5;56;;42;8211;9;"";RUE;PEYRON;38200;"";;1;"";;5;Profession libérale ;6910Z;Activités juridiques;2010;00;NN;20100201;2010;1;201209;"";"";"";P;S;0;O; ;;STORA*ALEXANDRA SARAH/;"";2;"";"";6910Z;Activités juridiques;2008;"";00;NN;2010;PME;20060401;201209;1;S;O;"";"";"";"";"";"";"";;;;84;38544;F;0;1;0;0;27/02/2018
49469085200020;MONSIEUR MURAT GIDER;GM CARRELAGE;ST MARTIN II;6 RES SAINT MARTIN;"";38200 VIENNE;"";84;38;3;99;544;VIENNE;00;243800455;5;56;;42;8211;6;"";RES;SAINT MARTIN;38200;"";;1;"";;3;Artisan ;4333Z;Travaux de revêtement des sols et des murs;2017;00;NN;20170926;2017;1;201709;14;91;"";P;S;0;O; ;;GIDER*MURAT/;"";1;"";"";4333Z;Travaux de revêtement des sols et des murs;2008;4333ZZ;00;NN;2017;"";20070305;201709;"";S;O;"";"";"";"";"";"";"";;;;84;38544;C;"";1;"";"";27/02/2018
50200419500017;MONSIEUR HASAN NAR;ENTREPRISE NAR;MALISSOL 1 LOGT 232 MALISSOL 1 LOGT 23;19 AVENUE JEAN DE LA FONTAINE;BP 322;38204 VIENNE CEDEX;FRANCE;84;38;3;99;544;VIENNE;00;243800455;5;56;;42;8211;19;"";AV;JEAN DE LA FONTAINE;38200;"";;1;"";;3;Artisan ;4399C;Travaux de maçonnerie générale et gros oeuvre de bâtiment;2008;02;3;20080117;2015;1;201209;14;91;"";P;S;0;O;"";;NAR*HASAN/;"";1;"";"";4399C;Travaux de maçonnerie générale et gros oeuvre de bâtiment;2008;4399CZ;02;3;2015;PME;20080117;201209;1;S;O;"";"";"";"";"";"";"";;;;84;38544;E;"";1;"";"";27/02/2018
50267780000018;MONSIEUR OMER CORUK;CEMELE STORE;MALISSOL;4 RUE FRANCOIS MANSART;"";38200 VIENNE;FRANCE;84;38;3;99;544;VIENNE;00;243800455;5;56;;42;8211;4;"";RUE;FRANCOIS MANSART;38200;"";;1;"";;2;Commerçant ;4789Z;Autres commerces de détail sur éventaires et marchés;2017;00;NN;20080220;2008;1;201709;10;93;"";P;S;0;O; ;;CORUK*OMER/;"";1;"";"";4789Z;Autres commerces de détail sur éventaires et marchés;2017;"";00;NN;2008;"";20080220;201709;"";S;O;"";"";"";"";"";"";"";;;;84;38544;C;"";1;"";"";27/02/2018
51118794000032;MADAME MELANIE COTTON RODRIGUES;"";"";42 MONTEE BON ACCUEIL;"";38200 VIENNE;FRANCE;84;38;3;99;544;VIENNE;00;243800455;5;56;;42;8211;42;"";MTE;DE BON ACCUEIL;38200;"";;1;"";;5;Profession libérale ;7490B;Activités spécialisées, scientifiques et techniques diverses;2010;00;NN;20101004;2010;1;201209;"";"";"";P;S;0;O;"";;COTTON*COTTON-RODRIGUES/MELANIE/;"";2;"";"";7490B;Activités spécialisées, scientifiques et techniques diverses;2010;"";00;NN;2010;PME;20090305;201209;1;S;O;"";"";"";"";"";"";"";;;;84;38544;O;"";1;"";"";27/02/2018
52284180800010;JEFARY;LES CARNETS DE SOPHIA;"";26 RUE JOSEPH BRENIER;"";38200 VIENNE;FRANCE;84;38;3;99;544;VIENNE;00;243800455;5;56;;42;8211;26;"";RUE;JOSEPH BRENIER;38200;"";;1;LES CARNETS DE SOPHIA;;"";"";4771Z;Commerce de détail d'habillement en magasin spécialisé;2010;01;1;20100601;2015;9;201209;10;05;1 ;P;S;0;O;"";;JEFARY;"";"";5498;SARL unipersonnelle ;4771Z;Commerce de détail d'habillement en magasin spécialisé;2010;"";01;1;2015;PME;20100601;201209;1;S;O;"";"";"";"";"";"";"";;;;84;38544;I;"";1;"";"";27/02/2018
52284180800010;JEFARY;LES CARNETS DE SOPHIA;"";26 RUE JOSEPH BRENIER;"";38200 VIENNE;"";84;38;3;99;544;VIENNE;00;243800455;5;56;;42;8211;26;"";RUE;JOSEPH BRENIER;38200;"";;0;LES CARNETS DE SOPHIA;;"";"";4771Z;Commerce de détail d'habillement en magasin spécialisé;2010;01;1;20100601;2015;9;201209;10;05;1 ;P;S;0;O; ;;JEFARY;"";"";5498;SARL unipersonnelle ;4771Z;Commerce de détail d'habillement en magasin spécialisé;2010;"";01;1;2015;PME;20100601;201209;1;S;O;"";"";"";"";"";"";"";;;;84;38544;F;0;1;0;0;27/02/2018
52284180800028;JEFARY;"";"";16 RUE JOSEPH BRENIER;"";38200 VIENNE;FRANCE;84;38;3;99;544;VIENNE;00;243800455;5;56;;42;8211;16;"";RUE;JOSEPH BRENIER;38200;"";;1;"";;"";"";4771Z;Commerce de détail d'habillement en magasin spécialisé;2017;01;NN;20170812;2017;1;201709;"";"";"";P;S;0;O; ;;JEFARY;"";"";5498;SARL unipersonnelle ;4771Z;Commerce de détail d'habillement en magasin spécialisé;2010;"";01;1;2015;PME;20100601;201209;1;S;O;"";"";"";"";"";"";"";;;;84;38544;C;"";1;"";"";27/02/2018
52365743500013;MADAME VIOLAINE BERTHON;"";"";102 MONTEE SAINT MARCEL;"";38200 VIENNE;FRANCE;84;38;3;99;544;VIENNE;00;243800455;5;56;;42;8211;102;"";MTE;SAINT MARCEL;38200;"";;1;"";;5;Profession libérale ;7490B;Activités spécialisées, scientifiques et techniques diverses;2017;00;NN;20100701;2010;1;201709;"";"";"";P;S;0;O; ;;COQUET*BERTHON/VIOLAINE/;"";2;"";"";7490B;Activités spécialisées, scientifiques et techniques diverses;2017;"";00;NN;2010;"";20100701;201709;"";S;O;"";"";"";"";"";"";"";;;;84;38544;C;"";1;"";"";27/02/2018
61368003200026;AUTOMOBILES VIENNE SUD;"";"";163 AVENUE GENERAL LECLERC;BP 349;38204 VIENNE CEDEX;FRANCE;84;38;3;99;544;VIENNE;00;243800455;5;56;;42;8211;163;"";AV;GAL LECLERC;38200;38204;;1;"";;"";"";4511Z;Commerce de voitures et de véhicules automobiles légers;2008;12;20;19000101;2015;"";201209;NR;05;2 ;P;S;0;O;"";;AUTOMOBILES VIENNE SUD;AVS;"";5710;SAS, société par actions simplifiée;4511Z;Commerce de voitures et de véhicules automobiles légers;2008;"";12;20;2015;PME;19610101;201209;1;S;O;2014;5;4511Z;4511Z;4532Z;6619B;4730Z;;;;84;38544;I;"";1;"";"";27/02/2018
61368003200026;AUTOMOBILES VIENNE SUD;"";"";163 AV GAL LECLERC;BP 349;38204 VIENNE CEDEX;"";84;38;3;99;544;VIENNE;00;243800455;5;56;;42;8211;163;"";AV;GAL LECLERC;38200;38204;;1;"";;"";"";4511Z;Commerce de voitures et de véhicules automobiles légers;2008;12;20;19000101;2015;"";201209;NR;05;2 ;P;S;0;O; ;;AUTOMOBILES VIENNE SUD;AVS;"";5710;SAS, société par actions simplifiée;4511Z;Commerce de voitures et de véhicules automobiles légers;2008;"";12;20;2015;PME;19610101;201209;1;S;O;2014;5;4511Z;4511Z;4532Z;6619B;4730Z;;;;84;38544;F;0;1;0;0;27/02/2018
74987841900029;AMYN;LE SAXO ESPACE GERMAI;IMMEUBLE SAINT;30 AVENUE GENERAL LECLERC;"";38200 VIENNE;FRANCE;84;38;3;99;544;VIENNE;00;243800455;5;56;;42;8211;30;"";AV;GAL LECLERC;38200;"";;1;"";;"";"";6820A;Location de logements;2017;00;NN;20170717;2017;NR;201708;"";"";"";P;S;0;N; ;;AMYN;"";"";6540;Société civile immobilière ;6820A;Location de logements;2017;"";00;NN;2012;"";20120217;201209;"";S;N;"";"";"";"";"";"";"";;;;84;38544;I;"";0;"";"";27/02/2018
74987841900029;AMYN;"";IMMEUBLE LE SAXO ESPACE SAINT GERMAI;30 AV GAL LECLERC;"";38200 VIENNE;"";84;38;3;99;544;VIENNE;00;243800455;5;56;;42;8211;30;"";AV;GAL LECLERC;38200;"";;1;"";;"";"";6820B;Location de terrains et d'autres biens immobiliers;2017;00;NN;20170717;2017;NR;201708;99;99;"";P;S;0;N; ;;AMYN;"";"";6540;Société civile immobilière ;6820B;Location de terrains et d'autres biens immobiliers;2017;"";00;NN;2012;"";20120217;201209;"";S;N;"";"";"";"";"";"";"";;;;84;38544;F;1;0;1;1;27/02/2018
75047088200028;LE SECRETARIAT MEDICAL;ESPACE ST GERMAIN;IMMEUBLE LE SAXO;30 AVENUE GENERAL LECLERC;"";38200 VIENNE;FRANCE;84;38;3;99;544;VIENNE;00;243800455;5;56;;42;8211;30;"";AV;GAL LECLERC;38200;"";;1;"";;"";"";8220Z;Activités de centres d'appels;2016;02;3;20150601;2015;1;201507;99;99;"";P;S;0;O;"";;LE SECRETARIAT MEDICAL;LSM;"";5498;SARL unipersonnelle ;8220Z;Activités de centres d'appels;2016;8219ZP;02;3;2015;PME;20120402;201209;1;S;O;"";"";"";"";"";"";"";;;;84;38544;I;"";1;"";"";27/02/2018
75047088200028;LE SECRETARIAT MEDICAL;"";ESPACE ST GERMAIN IMMEUBLE LE SAXO;30 AV GAL LECLERC;"";38200 VIENNE;"";84;38;3;99;544;VIENNE;00;243800455;5;56;;42;8211;30;"";AV;GAL LECLERC;38200;"";;1;"";;"";"";8219Z;Photocopie prépa. documents & aut. activ. spéc. soutien de bureau;2017;02;3;20150601;2015;1;201507;12;NR;"";P;S;0;O; ;;LE SECRETARIAT MEDICAL;LSM;"";5498;SARL unipersonnelle ;8219Z;Photocopie prépa. documents & aut. activ. spéc. soutien de bureau;2017;8219ZP;02;3;2015;PME;20120402;201209;1;S;O;"";"";"";"";"";"";"";;;;84;38544;F;1;1;1;1;27/02/2018
75290351800013;SAAS FINANCES;SAAS FINANCES;"";RUE MARCHANDE;"";38200 VIENNE;"";84;38;3;99;544;VIENNE;00;243800455;5;56;;42;8211;"";"";RUE;MARCHANDE;38200;"";;1;SAAS FINANCES;;"";"";6622Z;Activités des agents et courtiers d'assurances;2012;02;3;20120701;2015;4;201209;12;07;"";P;S;0;O;"";;SAAS FINANCES;"";"";5499;Société à responsabilité limitée (sans autre indication);6622Z;Activités des agents et courtiers d'assurances;2012;"";02;3;2015;PME;20120701;201209;1;S;O;"";"";"";"";"";"";"";;;;84;38544;I;"";1;"";"";27/02/2018
75290351800013;SAAS FINANCES;35 37;"";35 RUE MARCHANDE;"";38200 VIENNE;FRANCE;84;38;3;99;544;VIENNE;00;243800455;5;56;;42;8211;35;"";RUE;MARCHANDE;38200;"";;1;SAAS FINANCES;;"";"";6622Z;Activités des agents et courtiers d'assurances;2012;02;3;20120701;2015;4;201209;12;07;"";P;S;0;O; ;;SAAS FINANCES;"";"";5498;SARL unipersonnelle ;6622Z;Activités des agents et courtiers d'assurances;2012;"";02;3;2015;PME;20120701;201209;1;S;O;"";"";"";"";"";"";"";;;;84;38544;F;0;1;0;1;27/02/2018
75305312300018;GLOBECO;"";"";16 RUE JEAN MOULIN;"";38200 VIENNE;FRANCE;84;38;3;99;544;VIENNE;00;243800455;5;56;;42;8211;16;"";RUE;JEAN MOULIN;38200;"";;1;GLOBECO;;"";"";7490A;Activité des économistes de la construction;2012;00;0;20120701;2015;4;201209;12;93;"";P;S;0;O;"";;GLOBECO;"";"";5498;SARL unipersonnelle ;7490A;Activité des économistes de la construction;2012;"";00;0;2015;PME;20120701;201209;1;S;O;"";"";"";"";"";"";"";;;;84;38544;E;"";1;"";"";27/02/2018
75305312300026;GLOBECO;"";"";118 AVENUE GENERAL LECLERC;"";38200 VIENNE;FRANCE;84;38;3;99;544;VIENNE;00;243800455;5;56;;42;8211;118;"";AV;GAL LECLERC;38200;"";;1;GLOBECO;;"";"";7490A;Activité des économistes de la construction;2017;00;NN;20170901;2017;4;201709;"";"";"";P;S;0;O; ;;GLOBECO;"";"";5498;SARL unipersonnelle ;7490A;Activité des économistes de la construction;2012;"";00;0;2015;PME;20120701;201209;1;S;O;"";"";"";"";"";"";"";;;;84;38544;C;"";1;"";"";27/02/2018
78805937600343;APAJH;"";"";25 RUE DENFERT ROCHEREAU;"";38200 VIENNE;FRANCE;84;38;3;99;544;VIENNE;00;243800455;5;56;;42;8211;25;"";RUE;DENFERT ROCHEREAU;38200;"";;0;"";;"";"";8810C;Aide par le travail;2017;11;NN;20171001;2017;1;201709;"";"";"";P;S;0;N; ;;APAJH;"";"";9220;Association déclarée ;8810B;Accueil accompagn. sans héberg. adultes handicapés ou pers. âgées;2008;"";41;500;2015;ETI;19000101;201209;3;S;N;"";"";"";"";"";"";"";;;;84;38544;C;"";1;"";"";27/02/2018
78994745400011;LINEXIO;"";"";114 AVENUE GENERAL LECLERC;"";38200 VIENNE;FRANCE;84;38;3;99;544;VIENNE;00;243800455;5;56;;42;8211;114;"";AV;GAL LECLERC;38200;"";;1;"";;"";"";7021Z;Conseil en relations publiques et communication;2012;00;NN;20121213;2012;1;201209;12;07;"";P;S;0;O;"";;LINEXIO;"";"";5499;Société à responsabilité limitée (sans autre indication);7021Z;Conseil en relations publiques et communication;2012;"";00;NN;2012;PME;20121213;201209;1;S;O;"";"";"";"";"";"";"";;;;84;38544;I;"";1;"";"";27/02/2018
78994745400011;LINEXIO;LINEXIO;"";114 AV GAL LECLERC;"";38200 VIENNE;"";84;38;3;99;544;VIENNE;00;243800455;5;56;;42;8211;114;"";AV;GAL LECLERC;38200;"";;1;"";;"";"";7021Z;Conseil en relations publiques et communication;2012;00;NN;20121213;2012;1;201209;12;07;"";P;S;0;O; ;;LINEXIO;"";"";5499;Société à responsabilité limitée (sans autre indication);7021Z;Conseil en relations publiques et communication;2012;"";00;NN;2012;PME;20121213;201209;1;S;O;"";"";"";"";"";"";"";;;;84;38544;F;0;1;0;0;27/02/2018
79006685600010;MONSIEUR DIMITRI VACHON;"";"";4 MONTEE COUPE JARRET;"";38200 VIENNE;FRANCE;84;38;3;99;544;VIENNE;00;243800455;5;56;;42;8211;4;"";MTE;COUPE JARRET;38200;"";;1;"";;3;Artisan ;5110Z;Transports aériens de passagers;2016;00;NN;20121117;2012;1;201601;"";"";"";P;S;0;O;"";;VACHON*DIMITRI/;"";1;"";"";5110Z;Transports aériens de passagers;2016;"";00;NN;2012;PME;20121117;201601;1;S;O;"";"";"";"";"";"";"";;;;84;38544;E;"";1;"";"";27/02/2018
