SIRET;L1_NOMEN;L2_COMP;L3_CADR;L4_VOIE;L5_DISP;L6_POST;DEPET;L7_ETRG;RPET;ARRONET;CTONET;COMET;LIBCOM;DU;EPCI;TU;UU;CODEVOIE;TCD;ZEMET;NUMVOIE;INDREP;TYPVOIE;LIBVOIE;CODPOS;CEDEX;ZR1;SIEGE;ENSEIGNE;NOM_COM;NATETAB;LIBNATETAB;APET700;LIBAPET;DAPET;TEFET;EFETCENT;DCRET;DEFET;ORIGINE;AMINTRET;ACTIVNAT;LIEUACT;ACTISURF;SAISONAT;MODET;AUXILT;PRODET;PRODPART;ZR2;NOMEN_LONG;SIGLE;CIVILITE;NJ;LIBNJ;APEN700;LIBAPEN;DAPEN;APRM;TEFEN;EFENCENT;DEFEN;CATEGORIE;DCREN;AMINTREN;MONOACT;MODEN;PRODEN;ESAANN;TCA;ESAAPEN;ESASEC1N;ESASEC2N;ESASEC3N;ESASEC4N;REGIMP;MONOREG;ZR3;RPEN;DEPCOMEN;VMAJ;VMAJ1;IND_PUBLIPO;VMAJ2;VMAJ3;MAJ_DATE
32010280900219;LAYHER;"";"";164 CHEMIN DES PLATIERES;"";38670 CHASSE SUR RHONE;FRANCE;84;38;3;27;087;CHASSE SUR RHONE;00;243800455;7;58;;21;8214;164;"";CHE;DES PLATIERES;38670;"";;0;"";;"";"";4663Z;Comm de gros de machines pour l'extrac, la constr, le génie civil;2013;11;10;20131006;2015;1;201309;NR;NR;"";P;S;0;O;"";;LAYHER;"";"";5720;Société par actions simplifiée à associé unique ou société par actions simplifiée unipersonnelle ;4663Z;Comm de gros de machines pour l'extrac, la constr, le génie civil;2015;"";22;100;2015;ETI;19800901;201209;1;S;O;2014;7;7732Z;7732Z;4663Z;4399E;7740Z;;;;11;38087;I;"";1;"";"";27/02/2018
32010280900219;LAYHER;"";"";164 CHEMIN DES PLATIERES;"";38670 CHASSE SUR RHONE;FRANCE;84;38;3;27;087;CHASSE SUR RHONE;00;243800455;7;58;;21;8214;164;"";CHE;DES PLATIERES;38670;"";;0;"";;"";"";4663Z;Comm de gros de machines pour l'extrac, la constr, le génie civil;2013;11;10;20131006;2015;1;201309;NR;NR;"";P;S;0;O; ;;LAYHER;"";"";5720;Société par actions simplifiée à associé unique ou société par actions simplifiée unipersonnelle ;7732Z;Location et location-bail machines & équipts pour la construction;2016;"";22;100;2015;ETI;19800901;201209;1;S;O;2014;7;7732Z;7732Z;4663Z;4399E;7740Z;;;;11;38087;F;0;1;0;1;27/02/2018
38161713300016;MONSIEUR PIERRE GAY;"";"";CHEMIN DE TREMBAS;"";38670 CHASSE SUR RHONE;FRANCE;84;38;3;27;087;CHASSE SUR RHONE;00;243800455;7;58;;21;8214;"";"";"";TREMBAS;38670;"";;1;"";;6;Exploitant agricole ;0124Z;Culture de fruits à pépins et à noyau;2008;00;0;19740101;2011;1;201209;NR;99;"";P;S;0;O;"";;GAY*PIERRE/;"";1;"";"";0124Z;Culture de fruits à pépins et à noyau;2008;"";00;0;2011;"";19740101;201209;1;S;O;"";"";"";"";"";"";"";;;;84;38087;E;"";1;"";"";27/02/2018
39126180700021;ACILEMAT;"";"";235 RUE COPERNIC;"";38670 CHASSE SUR RHONE;FRANCE;84;38;3;27;087;CHASSE SUR RHONE;00;243800455;7;58;;21;8214;235;"";RUE;COPERNIC;38670;"";;1;"";;"";"";4663Z;Comm de gros de machines pour l'extrac, la constr, le génie civil;2014;03;6;20140717;2015;1;201410;"";"";"";P;S;0;O;"";;ACILEMAT;"";"";5499;Société à responsabilité limitée (sans autre indication);4663Z;Comm de gros de machines pour l'extrac, la constr, le génie civil;2008;3313ZZ;03;6;2015;PME;19930407;201209;1;S;O;"";"";"";"";"";"";"";;;;84;38087;E;"";1;"";"";27/02/2018
40216391900036;ASSOCIES ET STUDIO GUY RENAUX;"";ZONE ARTISANALE DES PLATIERES;605 CHEMIN DES PLATIERES;"";38670 CHASSE SUR RHONE;FRANCE;84;38;3;27;087;CHASSE SUR RHONE;00;243800455;7;58;;21;8214;605;"";CHE;DES PLATIERES;38670;"";;1;"";;"";"";7420Z;Activités photographiques;2017;00;NN;20170901;2017;1;201711;"";"";"";P;S;0;O; ;;ASSOCIES ET STUDIO GUY RENAUX;"";"";5499;Société à responsabilité limitée (sans autre indication);7420Z;Activités photographiques;2008;"";03;6;2015;PME;19950701;201209;1;S;O;"";"";"";"";"";"";"";;;;84;38087;C;"";1;"";"";27/02/2018
41499254500312;GDV GESTION DES VIANDES;"";CENTRE COMMERCIAL GRAND FRAIS;LIEUDIT LES CHARNEVEAUX;"";38670 CHASSE SUR RHONE;"";84;38;3;27;087;CHASSE SUR RHONE;00;243800455;7;58;;21;8214;"";"";"";LIEUDIT LES CHARNEVEAUX;38670;"";;0;"";;"";"";4722Z;Comm. détail viandes & produits à base de viande (magas. spéc.);2007;11;10;20070401;2015;9;201209;99;99;"";P;S;0;O;"";;GDV GESTION DES VIANDES;"";"";5599;SA à conseil d'administration (s.a.i.);4722Z;Comm. détail viandes & produits à base de viande (magas. spéc.);2008;"";32;300;2015;ETI;19980102;201209;2;S;O;2014;7;4722Z;4722Z;5621Z;1013A;"";;;;84;38087;I;"";1;"";"";27/02/2018
41499254500312;GDV GESTION DES VIANDES;"";CENTRE COMMERCIAL GRAND FRAIS;LIEUDIT LES CHARNEVEAUX;"";38670 CHASSE SUR RHONE;"";84;38;3;27;087;CHASSE SUR RHONE;00;243800455;7;58;;21;8214;"";"";"";LIEUDIT LES CHARNEVEAUX;38670;"";;0;"";;"";"";4722Z;Comm. détail viandes & produits à base de viande (magas. spéc.);2007;11;10;20070401;2015;9;201209;99;99;"";P;S;0;O; ;;GDV GESTION DES VIANDES;"";"";5710;SAS, société par actions simplifiée;4722Z;Comm. détail viandes & produits à base de viande (magas. spéc.);2008;"";32;300;2015;ETI;19980102;201209;2;S;O;2014;7;4722Z;4722Z;5621Z;1013A;"";;;;84;38087;F;0;1;0;1;27/02/2018
43397031600017;MONSIEUR STEPHANE SILVESTRIN;"";"";ALLEE DES NOYERS;"";38670 CHASSE SUR RHONE;FRANCE;84;38;3;27;087;CHASSE SUR RHONE;00;243800455;7;58;;21;8214;"";"";ALL;DES NOYERS;38670;"";;1;"";;3;Artisan ;4322A;Travaux d'installation d'eau et de gaz en tous locaux;2008;00;0;20010102;2004;1;201209;NR;91;"";P;S;0;O;"";;SILVESTRIN*STEPHANE/;"";1;"";"";4322A;Travaux d'installation d'eau et de gaz en tous locaux;2008;4322AZ;00;0;2004;PME;20010102;201209;1;S;O;"";"";"";"";"";"";"";;;;84;38087;I;"";1;"";"";27/02/2018
43397031600017;MONSIEUR STEPHANE SILVESTRIN;"";"";ALL DES NOYERS;"";38670 CHASSE SUR RHONE;"";84;38;3;27;087;CHASSE SUR RHONE;00;243800455;7;58;;21;8214;"";"";ALL;DES NOYERS;38670;"";;1;"";;3;Artisan ;4322A;Travaux d'installation d'eau et de gaz en tous locaux;2008;00;0;20010102;2004;1;201209;NR;91;"";P;S;0;O; ;;SILVESTRIN*STEPHANE/;"";1;"";"";4322A;Travaux d'installation d'eau et de gaz en tous locaux;2008;4322AZ;00;0;2004;PME;20010102;201209;1;S;O;"";"";"";"";"";"";"";;;;84;38087;F;0;1;0;0;27/02/2018
43529723900038;PHARM UP;"";"";104 AVENUE FREDERIC MISTRAL;"";38670 CHASSE SUR RHONE;FRANCE;84;38;3;27;087;CHASSE SUR RHONE;00;243800455;7;58;;21;8214;104;"";AV;FREDERIC MISTRAL;38670;"";;0;"";;"";"";4646Z;Commerce de gros de produits pharmaceutiques;2016;00;NN;20161201;2016;1;201612;NR;NR;"";P;S;0;O;"";;PHARM'UP;"";"";5710;SAS, société par actions simplifiée;4638B;Commerce de gros alimentaire spécialisé divers;2013;"";12;20;2015;PME;20010417;201209;1;S;O;2014;4;4638B;4638B;"";"";"";;;;84;38087;I;"";1;"";"";27/02/2018
43529723900038;PHARM UP;"";"";104 AVENUE FREDERIC MISTRAL;"";38670 CHASSE SUR RHONE;FRANCE;84;38;3;27;087;CHASSE SUR RHONE;00;243800455;7;58;;21;8214;104;"";AV;FREDERIC MISTRAL;38670;"";;0;"";;"";"";4646Z;Commerce de gros de produits pharmaceutiques;2016;00;NN;20161201;2016;1;201612;NR;NR;"";P;S;0;O; ;;PHARM'UP;"";"";5720;Société par actions simplifiée à associé unique ou société par actions simplifiée unipersonnelle ;4638B;Commerce de gros alimentaire spécialisé divers;2013;"";12;20;2015;PME;20010417;201209;1;S;O;2014;4;4638B;4638B;"";"";"";;;;84;38087;F;0;1;0;1;27/02/2018
43889498200034;MONSIEUR FARID SMILI;SMILI FARID;"";183 RUE CLAUDE PRIEST;"";38670 CHASSE SUR RHONE;FRANCE;84;38;3;27;087;CHASSE SUR RHONE;00;243800455;7;58;;21;8214;183;"";RUE;CLAUDE PRIEST;38670;"";;1;"";;2;Commerçant ;4781Z;Commerce de détail alimentaire sur éventaires et marchés;2017;00;NN;20171104;2017;1;201711;10;92;"";P;S;0;O; ;;SMILI*FARID/;"";1;"";"";4781Z;Commerce de détail alimentaire sur éventaires et marchés;2008;"";00;NN;2017;"";20010806;201711;"";S;O;"";"";"";"";"";"";"";;;;84;38087;C;"";1;"";"";27/02/2018
45109143300032;ETLM SARL;PROTECH;ZAC DES PLATIERES;432 CHEMIN DES PLATIERES;"";38670 CHASSE SUR RHONE;FRANCE;84;38;3;27;087;CHASSE SUR RHONE;00;243800455;7;58;;21;8214;432;"";CHE;DES PLATIERES;38670;"";;1;"";;"";"";8121Z;Nettoyage courant des bâtiments;2017;00;NN;20171201;2017;1;201711;"";"";"";P;S;0;O; ;;ETLM SARL;"";"";5499;Société à responsabilité limitée (sans autre indication);8121Z;Nettoyage courant des bâtiments;2017;"";02;3;2015;PME;20030201;201209;1;S;O;"";"";"";"";"";"";"";;;;84;38087;C;"";1;"";"";27/02/2018
48824475700016;MESSU;CHASSE KEBAB;"";4 AVENUE DE LA GARE;"";38670 CHASSE SUR RHONE;FRANCE;84;38;3;27;087;CHASSE SUR RHONE;00;243800455;7;58;;21;8214;4;"";AV;DE LA GARE;38670;"";;1;"";;"";"";5610C;Restauration de type rapide;2008;02;3;20060102;2015;3;201209;10;05;"";P;S;0;O;"";;MESSU;"";"";5499;Société à responsabilité limitée (sans autre indication);5610C;Restauration de type rapide;2008;"";02;3;2015;PME;20060102;201209;1;S;O;"";"";"";"";"";"";"";;;;84;38087;E;"";1;"";"";27/02/2018
50056940503155;DECATHLON FRANCE;DECATHLON;ZONE COMMERCIALE CHASSE SUD;1963 AVENUE FREDERIC MISTRAL;"";38670 CHASSE SUR RHONE;FRANCE;84;38;3;27;087;CHASSE SUR RHONE;00;243800455;7;58;;21;8214;1963;"";AV;FREDERIC MISTRAL;38670;"";;0;DECATHLON;;"";"";4764Z;Commerce de détail d'articles de sport en magasin spécialisé;2013;12;20;20130820;2015;1;201307;10;05;4 ;P;S;0;O;"";;DECATHLON FRANCE;"";"";5720;Société par actions simplifiée à associé unique ou société par actions simplifiée unipersonnelle ;4764Z;Commerce de détail d'articles de sport en magasin spécialisé;2007;"";53;14800;2015;GE;20071005;201209;2;S;O;"";"";"";"";"";"";"";;;;32;38087;I;"";1;"";"";27/02/2018
50056940503155;DECATHLON FRANCE;DECATHLON;ZONE COMMERCIALE CHASSE SUD;1963 AVENUE FREDERIC MISTRAL;"";38670 CHASSE SUR RHONE;FRANCE;84;38;3;27;087;CHASSE SUR RHONE;00;243800455;7;58;;21;8214;1963;"";AV;FREDERIC MISTRAL;38670;"";;0;DECATHLON;;"";"";4764Z;Commerce de détail d'articles de sport en magasin spécialisé;2013;12;20;20130820;2015;1;201307;10;05;4 ;P;S;0;O; ;;DECATHLON FRANCE;"";"";5720;Société par actions simplifiée à associé unique ou société par actions simplifiée unipersonnelle ;5210B;Entreposage et stockage non frigorifique;2016;"";53;14800;2015;GE;20071005;201209;2;S;O;"";"";"";"";"";"";"";;;;32;38087;F;0;1;0;1;27/02/2018
50295846500036;MONSIEUR JONATHAN FARRUGGIO;JO PISCINES;"";57 ROUTE DE VIENNE;"";38670 CHASSE SUR RHONE;FRANCE;84;38;3;27;087;CHASSE SUR RHONE;00;243800455;7;58;;21;8214;57;"";RTE;DE VIENNE;38670;"";;1;"";;3;Artisan ;4399A;Travaux d'étanchéification;2017;00;NN;20170313;2017;1;201703;14;93;"";P;S;0;O;"";;FARRUGGIO*JONATHAN/;"";1;"";"";4399A;Travaux d'étanchéification;2017;4399AZ;00;0;2015;PME;20080211;201703;1;S;O;"";"";"";"";"";"";"";;;;84;38087;E;"";1;"";"";27/02/2018
53190894500029;MADAME LUCIA RODRIGUEZ;"";BATIMENT L ALSACE;25 RUE VICTOR HUGO;"";38670 CHASSE SUR RHONE;"";84;38;3;27;087;CHASSE SUR RHONE;00;243800455;7;58;;21;8214;25;"";RUE;VICTOR HUGO;38670;"";;1;"";;5;Profession libérale ;8690F;Activités de santé humaine non classées ailleurs;2017;00;NN;20170701;2017;1;201711;"";"";"";P;S;0;O; ;;RODRIGUEZ*LUCIA/;"";2;"";"";8690F;Activités de santé humaine non classées ailleurs;2011;"";00;NN;2011;PME;20110401;201209;1;S;O;"";"";"";"";"";"";"";;;;84;38087;C;"";1;"";"";27/02/2018
53213513400023;MONSIEUR IMED BELOUETTAR;IB JOINTEUR;"";57 ROUTE DE VIENNE;"";38670 CHASSE SUR RHONE;FRANCE;84;38;3;27;087;CHASSE SUR RHONE;00;243800455;7;58;;21;8214;57;"";RTE;DE VIENNE;38670;"";;1;"";;3;Artisan ;4331Z;Travaux de plâtrerie;2017;00;NN;20171101;2017;1;201711;"";"";"";P;S;0;O; ;;BELOUETTAR*IMED/;"";1;"";"";4331Z;Travaux de plâtrerie;2011;4331ZB;00;NN;2011;PME;20110509;201209;1;S;O;"";"";"";"";"";"";"";;;;84;38087;C;"";1;"";"";27/02/2018
53215527200026;MONSIEUR THIERRY GELADZE;GT SPORTS;"";219 CHEMIN DES GOULES;"";38670 CHASSE SUR RHONE;FRANCE;84;38;3;27;087;CHASSE SUR RHONE;00;243800455;7;58;;21;8214;219;"";CHE;DES GOULES;38670;"";;1;"";;2;Commerçant ;4799B;Vente par automate, aut. com. dét. hors mag., éventaire ou marché;2017;00;NN;20171013;2017;1;201711;"";"";"";P;S;0;O; ;;GELADZE*THIERRY RENE JACKY/;"";1;"";"";4799B;Vente par automate, aut. com. dét. hors mag., éventaire ou marché;2017;"";00;NN;2011;PME;20110502;201209;1;S;O;"";"";"";"";"";"";"";;;;84;38087;C;"";1;"";"";27/02/2018
53801969600011;CARROSSERIE DES CHASSERES;"";"";275 CHEMIN DES GOULES;"";38670 CHASSE SUR RHONE;FRANCE;84;38;3;27;087;CHASSE SUR RHONE;00;243800455;7;58;;21;8214;275;"";CHE;DES GOULES;38670;"";;1;CARROSSERIE DES CHASSERES;;"";"";4520A;Entretien et réparation de véhicules automobiles légers;2011;02;3;20111201;2015;1;201209;06;09;"";P;S;0;O;"";;CARROSSERIE DES CHASSERES;"";"";5499;Société à responsabilité limitée (sans autre indication);4520A;Entretien et réparation de véhicules automobiles légers;2011;4520AC;02;3;2015;PME;20111201;201209;1;S;O;"";"";"";"";"";"";"";;;;84;38087;I;"";1;"";"";27/02/2018
53801969600011;CARROSSERIE DES CHASSERES;CARROSSERIE DES CHASSERES;"";275 CHE DES GOULES;"";38670 CHASSE SUR RHONE;"";84;38;3;27;087;CHASSE SUR RHONE;00;243800455;7;58;;21;8214;275;"";CHE;DES GOULES;38670;"";;1;CARROSSERIE DES CHASSERES;;"";"";4520A;Entretien et réparation de véhicules automobiles légers;2011;02;3;20111201;2015;1;201209;06;09;"";P;S;0;O; ;;CARROSSERIE DES CHASSERES;"";"";5710;SAS, société par actions simplifiée;4520A;Entretien et réparation de véhicules automobiles légers;2011;4520AC;02;3;2015;PME;20111201;201209;1;S;O;"";"";"";"";"";"";"";;;;84;38087;F;0;1;0;1;27/02/2018
79149337200027;MONSIEUR LEONAS CURECHERU;"";"";211 RUE CLAUDE PRIEST;"";38670 CHASSE SUR RHONE;FRANCE;84;38;3;27;087;CHASSE SUR RHONE;00;243800455;7;58;;21;8214;211;"";RUE;CLAUDE PRIEST;38670;"";;1;"";;3;Artisan ;4331Z;Travaux de plâtrerie;2015;00;NN;20150301;2015;1;201503;14;91;"";P;S;0;O;"";;CURECHERU*LEONAS/;"";1;"";"";4331Z;Travaux de plâtrerie;2015;4334ZC;00;NN;2015;PME;20130101;201302;1;S;O;"";"";"";"";"";"";"";;;;84;38087;E;"";1;"";"";27/02/2018
79453311700022;MONSIEUR EMMANUEL JEAN GERARD FULCRAND;LES JARDINS DE MANU;"";8 ALLEE DES TROENES;"";38670 CHASSE SUR RHONE;FRANCE;84;38;3;27;087;CHASSE SUR RHONE;00;243800455;7;58;;21;8214;8;"";ALL;DES TROENES;38670;"";;1;"";;3;Artisan ;8130Z;Services d'aménagement paysager;2015;00;NN;20150320;2015;1;201503;"";"";"";P;S;0;O;"";;FULCRAND*EMMANUEL JEAN GERARD/;"";1;"";"";8130Z;Services d'aménagement paysager;2013;"";00;NN;2015;PME;20130801;201307;1;S;O;"";"";"";"";"";"";"";;;;84;38087;E;"";1;"";"";27/02/2018
81829751700026;M2EI;"";ZAC DES PLATIERES;85 CHEMIN DES PLATIERES;"";38670 CHASSE SUR RHONE;FRANCE;84;38;3;27;087;CHASSE SUR RHONE;00;243800455;7;58;;21;8214;85;"";CHE;DES PLATIERES;38670;"";;1;"";;"";"";4321A;Travaux d'installation électrique dans tous locaux;2017;02;NN;20171012;2017;1;201710;"";"";"";P;S;0;O; ;;M2EI;"";"";5720;Société par actions simplifiée à associé unique ou société par actions simplifiée unipersonnelle ;4321A;Travaux d'installation électrique dans tous locaux;2016;"";03;NN;2016;"";20160205;201602;1;S;O;"";"";"";"";"";"";"";;;;84;38087;I;"";1;"";"";27/02/2018
81829751700026;M2EI;"";ZAC DES PLATIERES;85 CHE DES PLATIERES;"";38670 CHASSE SUR RHONE;"";84;38;3;27;087;CHASSE SUR RHONE;00;243800455;7;58;;21;8214;85;"";CHE;DES PLATIERES;38670;"";;1;"";;"";"";4321A;Travaux d'installation électrique dans tous locaux;2017;02;NN;20171012;2017;1;201710;"";"";"";P;S;0;O; ;;M2EI;"";"";5720;Société par actions simplifiée à associé unique ou société par actions simplifiée unipersonnelle ;4321A;Travaux d'installation électrique dans tous locaux;2016;4321AB;03;NN;2016;"";20160205;201602;1;S;O;"";"";"";"";"";"";"";;;;84;38087;F;0;1;0;0;27/02/2018
82872652100028;DDBT;"";"";351 ROUTE DE GIVORS;"";38670 CHASSE SUR RHONE;FRANCE;84;38;3;27;087;CHASSE SUR RHONE;00;243800455;7;58;;21;8214;351;"";RTE;DE GIVORS;38670;"";;0;"";;"";"";7490A;Activité des économistes de la construction;2017;02;NN;20170401;2017;1;201704;12;93;"";P;S;0;O;"";;DDBT;"";"";5710;SAS, société par actions simplifiée;7490A;Activité des économistes de la construction;2017;"";00;NN;2017;"";20170327;201704;"";S;O;"";"";"";"";"";"";"";;;;11;38087;I;"";1;"";"";27/02/2018
82872652100028;DDBT;"";"";351 RTE DE GIVORS;"";38670 CHASSE SUR RHONE;"";84;38;3;27;087;CHASSE SUR RHONE;00;243800455;7;58;;21;8214;351;"";RTE;DE GIVORS;38670;"";;0;"";;"";"";7112B;Ingénierie, études techniques;2017;02;NN;20170401;2017;1;201704;12;93;"";P;S;0;O; ;;DDBT;"";"";5710;SAS, société par actions simplifiée;7112B;Ingénierie, études techniques;2017;"";00;NN;2017;"";20170327;201704;"";S;O;"";"";"";"";"";"";"";;;;11;38087;F;0;1;1;1;27/02/2018
83009570900010;SALON & DESIGN;"";"";5050 AVENUE FREDERIC MISTRAL;"";38670 CHASSE SUR RHONE;FRANCE;84;38;3;27;087;CHASSE SUR RHONE;00;243800455;7;58;;21;8214;5050;"";AV;FREDERIC MISTRAL;38670;"";;1;SALON & DESIGN;;"";"";4759A;Commerce de détail de meubles;2017;00;NN;20170515;2017;1;201706;10;05;1 ;P;S;0;O;"";;SALON & DESIGN;"";"";5710;SAS, société par actions simplifiée;4759A;Commerce de détail de meubles;2017;"";00;NN;2017;"";20170515;201706;"";S;O;"";"";"";"";"";"";"";;;;84;38087;I;"";1;"";"";27/02/2018
83009570900010;SALON & DESIGN;SALON & DESIGN;"";5050 AV FREDERIC MISTRAL;"";38670 CHASSE SUR RHONE;"";84;38;3;27;087;CHASSE SUR RHONE;00;243800455;7;58;;21;8214;5050;"";AV;FREDERIC MISTRAL;38670;"";;1;SALON & DESIGN;;"";"";4759A;Commerce de détail de meubles;2017;00;NN;20170515;2017;1;201706;10;05;1 ;P;S;0;O; ;;SALON & DESIGN;"";"";5710;SAS, société par actions simplifiée;4759A;Commerce de détail de meubles;2017;"";00;NN;2017;"";20170515;201706;"";S;O;"";"";"";"";"";"";"";;;;84;38087;F;0;1;0;0;27/02/2018
83301424400010;UPOP;"";"";1 ALLEE DES EUCALYPTUS;"";38670 CHASSE SUR RHONE;FRANCE;84;38;3;27;087;CHASSE SUR RHONE;00;243800455;7;58;;21;8214;1;"";ALL;DES EUCALYPTUS;38670;"";;1;"";;"";"";9499Z;Autres organisations fonctionnant par adhésion volontaire;2016;00;NN;20160210;2016;1;201711;"";"";"";P;S;0;N; ;;UNIVERSIT POPULAIRE OUVERTE DU PAYS VIENNOIS;UPOP;"";9220;Association déclarée ;9499Z;Autres organisations fonctionnant par adhésion volontaire;2016;"";00;NN;2016;"";20160210;201711;"";S;N;"";"";"";"";"";"";"";;;;84;38087;C;"";1;"";"";27/02/2018
83316824800015;SCI DE LA SAULAIE;"";ZONE INDUSTRIELLE DE LA SAULAIE;121 CHEMIN DE LA SAULAIE;"";38670 CHASSE SUR RHONE;FRANCE;84;38;3;27;087;CHASSE SUR RHONE;00;243800455;7;58;;21;8214;121;"";CHE;DE LA SAULAIE;38670;"";;1;"";;"";"";6820A;Location de logements;2017;00;NN;20171020;2017;NR;201711;99;99;"";P;S;0;N; ;;SCI DE LA SAULAIE;"";"";6540;Société civile immobilière ;6820A;Location de logements;2017;"";00;NN;2017;"";20171020;201711;"";S;N;"";"";"";"";"";"";"";;;;84;38087;C;"";0;"";"";27/02/2018
40935144200010;MONSIEUR MICHEL BRACOUD;"";"";"";"";38121 CHONAS L AMBALLAN;FRANCE;84;38;3;28;107;CHONAS L'AMBALLAN;00;243800455;5;56;;14;8211;"";"";"";"";38121;"";;1;"";;6;Exploitant agricole ;0124Z;Culture de fruits à pépins et à noyau;2008;00;0;19801231;2015;1;201209;NR;99;"";P;S;0;O;"";;BRACOUD*MICHEL/;"";1;"";"";0124Z;Culture de fruits à pépins et à noyau;2008;"";00;0;2015;"";19801231;201209;1;S;O;"";"";"";"";"";"";"";;;;84;38107;E;"";1;"";"";27/02/2018
50833014900032;MONSIEUR SERKAN UZUN;PPJ;"";280 CHEMIN DES FONTANETTES;"";38121 CHONAS L AMBALLAN;FRANCE;84;38;3;28;107;CHONAS L'AMBALLAN;00;243800455;5;56;;14;8211;280;"";CHE;DES FONTANETTES;38121;"";;1;"";;3;Artisan ;4331Z;Travaux de plâtrerie;2017;00;NN;20171016;2017;NR;201711;14;91;"";P;S;0;O; ;;UZUN*SERKAN/;"";1;"";"";4331Z;Travaux de plâtrerie;2013;4331ZB;00;NN;2017;"";20081101;201711;"";S;O;"";"";"";"";"";"";"";;;;84;38107;C;"";1;"";"";27/02/2018
79540537200017;CYRIL ET LAURIE;LES HAUTS DU VILLAGE;"";CHEMIN DE L EGLISE;"";38121 CHONAS L AMBALLAN;FRANCE;84;38;3;28;107;CHONAS L'AMBALLAN;00;243800455;5;56;;14;8211;"";"";CHE;DE  L EGLISE;38121;"";;1;CYRIL ET LAURIE;;"";"";1071C;Boulangerie et boulangerie-pâtisserie;2013;01;1;20130918;2015;3;201309;04;05;"";P;S;0;O;"";;CYRIL ET LAURIE;"";"";5499;Société à responsabilité limitée (sans autre indication);1071C;Boulangerie et boulangerie-pâtisserie;2013;"";01;1;2015;PME;20130918;201309;1;S;O;"";"";"";"";"";"";"";;;;84;38107;I;"";1;"";"";27/02/2018
79540537200017;CYRIL ET LAURIE;CYRIL ET LAURIE;LES HAUTS DU VILLAGE;CHE DE  L EGLISE;"";38121 CHONAS L'AMBALLAN;"";84;38;3;28;107;CHONAS L'AMBALLAN;00;243800455;5;56;;14;8211;"";"";CHE;DE  L EGLISE;38121;"";;1;CYRIL ET LAURIE;;"";"";1071C;Boulangerie et boulangerie-pâtisserie;2013;01;1;20130918;2015;3;201309;04;05;"";P;S;0;O; ;;CYRIL ET LAURIE;"";"";5499;Société à responsabilité limitée (sans autre indication);1071C;Boulangerie et boulangerie-pâtisserie;2013;"";01;1;2015;PME;20130918;201309;1;S;O;"";"";"";"";"";"";"";;;;84;38107;F;0;1;0;0;27/02/2018
81771731700017;MONSIEUR ANDRE MICHELIS;"";63 PASSAGE DU LAVOIR;7 LOTISSEMENT LES FORSYTHIAS;"";38121 CHONAS L AMBALLAN;FRANCE;84;38;3;28;107;CHONAS L'AMBALLAN;00;243800455;5;56;;14;8211;63;"";PAS;DU LAVOIR;38121;"";;1;"";;5;Profession libérale ;7112B;Ingénierie, études techniques;2015;00;NN;20151201;2015;1;201601;"";"";"";P;S;0;O;"";;MICHELIS*ANDRE JEROME/;"";1;"";"";7112B;Ingénierie, études techniques;2015;"";00;NN;2015;PME;20151201;201601;1;S;O;"";"";"";"";"";"";"";;;;84;38107;E;"";1;"";"";27/02/2018
82918671700015;MONSIEUR YANN GONIN;"";"";348 CHEMIN DE LIEURAZ;"";38121 CHONAS L AMBALLAN;FRANCE;84;38;3;28;107;CHONAS L'AMBALLAN;00;243800455;5;56;;14;8211;348;"";CHE;DE LIEURAZ;38121;"";;1;"";;6;Exploitant agricole ;0162Z;Activités de soutien à la production animale;2017;00;NN;20170421;2017;1;201704;"";"";"";P;S;0;O;"";;GONIN*YANN/;"";1;"";"";0162Z;Activités de soutien à la production animale;2017;"";00;NN;2017;"";20170421;201704;1;S;O;"";"";"";"";"";"";"";;;;84;38107;E;"";1;"";"";27/02/2018
30562380300049;MONSIEUR PIERRE DRUKMACHER;"";"";280 RUE DU VERDIER;"";38200 CHUZELLES;FRANCE;84;38;3;27;110;CHUZELLES;"";243800455;0;"";;15;8211;280;"";RUE;DE VERDIER;38200;"";;1;"";;5;Profession libérale ;8690E;Activité profess. rééducation appareillage & pédicures-podologues;2010;00;NN;20100313;2010;1;201604;"";"";"";P;S;0;O;"";;DRUKMACHER*PIERRE/;"";1;"";"";8690E;Activité profess. rééducation appareillage & pédicures-podologues;2008;"";00;0;2004;PME;19000101;201209;1;S;O;"";"";"";"";"";"";"";;;;84;38110;E;"";1;"";"";27/02/2018
50197181600035;MONSIEUR YOANN MORAND;RIDE AND SPORT;N 5 LOTISSEMENT;134 RUE DU VERDIER;"";38200 CHUZELLES;FRANCE;84;38;3;27;110;CHUZELLES;"";243800455;0;"";;15;8211;134;"";RUE;DU VERDIER;38200;"";;1;"";;2;Commerçant ;4789Z;Autres commerces de détail sur éventaires et marchés;2016;00;NN;20160701;2016;1;201610;"";"";"";P;S;0;O;"";;MORAND*YOANN/;"";1;"";"";4789Z;Autres commerces de détail sur éventaires et marchés;2016;"";00;NN;2016;PME;20080121;201209;1;S;O;"";"";"";"";"";"";"";;;;84;38110;E;"";1;"";"";27/02/2018
52857222500050;PREVHOM;"";"";250 RTE DE THIERS;"";38200 CHUZELLES;"";84;38;3;27;110;CHUZELLES;"";243800455;0;"";;15;8211;250;"";RTE;DE THIERS;38200;"";;0;"";;"";"";7490B;Activités spécialisées, scientifiques et techniques diverses;2017;00;NN;20170713;2017;1;201711;NR;NR;"";P;S;0;O; ;;PREVHOM;"";"";5499;Société à responsabilité limitée (sans autre indication);7490B;Activités spécialisées, scientifiques et techniques diverses;2010;"";00;NN;2013;PME;20101210;201209;1;S;O;"";"";"";"";"";"";"";;;;84;38110;C;"";1;"";"";27/02/2018
78859376200024;MADAME SANDRA DE BARROS;"";"";121 CHEMIN DES BADIERES;"";38200 CHUZELLES;FRANCE;84;38;3;27;110;CHUZELLES;"";243800455;0;"";;15;8211;121;"";CHE;DES BADIERES;38200;"";;1;"";;5;Profession libérale ;9609Z;Autres services personnels n.c.a.;2017;00;NN;20170715;2017;1;201711;"";"";"";P;S;0;O; ;;DE BARROS*SANDRA CHRISTINE/;"";2;"";"";9609Z;Autres services personnels n.c.a.;2012;"";00;NN;2012;PME;20121001;201209;1;S;O;"";"";"";"";"";"";"";;;;84;38110;C;"";1;"";"";27/02/2018
80313563100015;TEMPO STREET PIZZA SASU FABIO LISA;"";"";PLACE DU BELVEDERE;"";38200 CHUZELLES;FRANCE;84;38;3;27;110;CHUZELLES;"";243800455;0;"";;15;8211;"";"";PL;DU BELVEDERE;38200;"";;1;"";;"";"";5610C;Restauration de type rapide;2014;00;NN;20140630;2014;NR;201406;10;05;"";P;S;0;O;"";;TEMPO STREET PIZZA SASU FABIO LISA;"";"";5720;Société par actions simplifiée à associé unique ou société par actions simplifiée unipersonnelle ;5610C;Restauration de type rapide;2014;"";00;NN;2014;PME;20140630;201406;1;S;O;"";"";"";"";"";"";"";;;;84;38110;I;"";1;"";"";27/02/2018
80313563100015;TEMPO STREET PIZZA SASU FABIO LISA;"";"";PL DU BELVEDERE;"";38200 CHUZELLES;"";84;38;3;27;110;CHUZELLES;"";243800455;0;"";;15;8211;"";"";PL;DU BELVEDERE;38200;"";;1;"";;"";"";5610C;Restauration de type rapide;2014;00;NN;20140630;2014;NR;201406;10;05;"";P;S;0;O; ;;TEMPO STREET PIZZA SASU FABIO LISA;"";"";5720;Société par actions simplifiée à associé unique ou société par actions simplifiée unipersonnelle ;5610C;Restauration de type rapide;2014;"";00;NN;2014;PME;20140630;201406;1;S;O;"";"";"";"";"";"";"";;;;84;38110;F;0;1;0;0;27/02/2018
81943168500026;MONSIEUR CHRIS VICAL;"";"";293 CHEMIN DE LA GRANDE COMBE;"";38200 CHUZELLES;FRANCE;84;38;3;27;110;CHUZELLES;"";243800455;0;"";;15;8211;293;"";CHE;DE LA GRANDE COMBE;38200;"";;1;"";;2;Commerçant ;6831Z;Agences immobilières;2017;00;NN;20171001;2017;NR;201711;NR;NR;"";P;S;0;O; ;;VICAL*CHRIS KEVIN/;"";1;"";"";6831Z;Agences immobilières;2017;"";00;NN;2017;"";20160314;201711;"";S;O;"";"";"";"";"";"";"";;;;84;38110;C;"";1;"";"";27/02/2018
83296908300019;LIMPIA NET;"";"";38 IMPASSE DE LA COMBE BLEUE;"";38200 CHUZELLES;FRANCE;84;38;3;27;110;CHUZELLES;"";243800455;0;"";;15;8211;38;"";IMP;DE LA COMBE BLEUE;38200;"";;1;"";;"";"";8121Z;Nettoyage courant des bâtiments;2017;00;NN;20171101;2017;1;201710;12;93;"";P;S;0;O; ;;LIMPIA.NET;"";"";5710;SAS, société par actions simplifiée;8121Z;Nettoyage courant des bâtiments;2017;"";00;NN;2017;"";20171101;201710;"";S;O;"";"";"";"";"";"";"";;;;84;38110;I;"";1;"";"";27/02/2018
83296908300019;LIMPIA.NET;"";"";38 IMP DE LA COMBE BLEUE;"";38200 CHUZELLES;"";84;38;3;27;110;CHUZELLES;"";243800455;0;"";;15;8211;38;"";IMP;DE LA COMBE BLEUE;38200;"";;1;"";;"";"";8121Z;Nettoyage courant des bâtiments;2017;00;NN;20171101;2017;1;201710;12;93;"";P;S;0;O; ;;LIMPIA.NET;"";"";5710;SAS, société par actions simplifiée;8121Z;Nettoyage courant des bâtiments;2017;8121ZZ;00;NN;2017;"";20171101;201710;"";S;O;"";"";"";"";"";"";"";;;;84;38110;F;0;1;0;0;27/02/2018
